inst name, eiin, inst_type, district, thana, mauza, long, lat, serial,isUnique
BELKA DEGREE COLLEGE,121759,College,GAIBANDHA,SUNDARGANJ,BELKA,89.576096,25.526882,685,1
HAJI OSMAN GANI COLLEGE,121186,College,GAIBANDHA,GAIBANDHA SADAR,DARIAPUR,89.540634,25.330786,686,1
GAIBANDHA GOVT. COLLEGE,121184,College,GAIBANDHA,GAIBANDHA SADAR,PASCHIM GOBINDAPUR,89.56011,25.43089,687,1
GAIBANDA ADARSHA COLLEGE,121185,College,GAIBANDHA,GAIBANDHA SADAR,MADHA GOBINDAPUR,89.52933,25.32144,688,1
GAIBANDHA GOVT. MOHILA COLLEGE,GAIBANDHA,121183,College,GAIBANDHA,GAIBANDHA SADAR,MADHYA PARA,89.51689,25.42597,689,1
LENGA BAZAR IDEAL COLLEGE,121188,College,GAIBANDHA,GAIBANDHA SADAR,MALIBARI,89.54292,25.33336,690,1
TULSHI GHAT SHAMSUL HAQUE DEGREE COLLEGE,121182,College,GAIBANDHA,GAIBANDHA SADAR,TULSHIGHAT,89.51417,25.27686,691,1
HARINABARI COLLEGE,121429,College,GAIBANDHA,PALASHBARI,HARINABARI,89.48319,25.24025,692,1
MARIRHAT MODEL COLLEGE,121430,College,GAIBANDHA,PALASHBARI,LAKSHMIPUR,89.48931,25.23503,693,1
FAKIRHAT SHAHID SMRITI DEGREE COLLEGE,121427,College,GAIBANDHA,PALASHBARI,BALA BAMANIA,89.44533,25.26797,694,1
PALASHBARI GOVT.COLLEGE gaibandha,121426,College,GAIBANDHA,PALASHBARI,NURPUR,89.35133,25.28222,695,1
PALASH BARI ADARSHA DEGREE COLLEGE,121425,College,GAIBANDHA,PALASHBARI,GIRIDHARIPUR,89.34761,25.26814,696,1
PALASH  BARI   MAHILA  COLLEGE,121428,College,GAIBANDHA,PALASHBARI,NUNIAGARI,89.35633,25.293,697,1
JOYEN PUR ADARSHA COLLEGE,121543,College,GAIBANDHA,SADULLAPUR,JAYENPUR,89.49136,25.38136,698,1
SADULLAPUR DEGREE COLLEGE,121539,College,GAIBANDHA,SADULLAPUR,SADULLAHPUR,89.46611,25.35461,699,1
SADULLAPUR GIRLS COLLEGE,121542,College,GAIBANDHA,SADULLAPUR,SADULLAHPUR,89.46608,25.39403,700,1
SHAH ASGAR ALI DEGREE COLLEGE,121537,College,GAIBANDHA,SADULLAPUR,GOBINDAPUR,89.39069,25.3645,701,1
MOHIPUR BAZAR COLLEGE,121540,College,GAIBANDHA,SADULLAPUR,MAHIPUR,89.36106,25.30686,702,1
KAMAR PARA COLLEGE,121541,College,GAIBANDHA,SADULLAPUR,KESALIDANGA,89.42475,25.33067,703,1
NALDANGA DEGREE COLLEGE,121538,College,GAIBANDHA,SADULLAPUR,NALDANGA,89.47167,25.48303,704,1
FULCHARI DEGREE COLLEGE,121099,College,GAIBANDHA,FULCHHARI,GAZARIA,89.40856,25.45269,705,1
KANCHIPARA DEHREE COLLEGE,121098,College,GAIBANDHA,FULCHHARI,GHOLDAHA,89.60725,25.32594,706,1
UDAKHALI MODEL COLLEGE,121096,College,GAIBANDHA,FULCHHARI,BURAIL,89.58622,25.30892,707,1
UDAKHALI WOMEN'S COLLEGE,121097,College,GAIBANDHA,FULCHHARI,UDAKHALI,89.57142,25.24786,708,1
BONARPARA DEGREE COLLEGE,121610,College,GAIBANDHA,SAGHATA,RAGHABPUR,89.52031,25.16628,709,1
SHAGHATA DEGREE COLLEGE,121609,College,GAIBANDHA,SAGHATA,GHURIDAHA,89.56942,25.08908,710,1
JUMARBARI ADARSHA COLLEGE,121611,College,GAIBANDHA,SAGHATA,CHAND PARA,89.55497,25.05192,711,1
KAMALER PARA COLLEGE,121612,College,GAIBANDHA,SAGHATA,KAMALER PARA,89.54867,25.07603,712,1
UDAYAN WOMEN'S COLLEGE,121608,College,GAIBANDHA,SAGHATA,PUTIMARI,89.57375,25.15603,713,1
SUNDARFANJ DEGREE WOMENS COLLEGE,121757,College,GAIBANDHA,SUNDARGANJ,BAMANJAL (PART),89.50011,25.59389,714,1
SUNDARGAJ D.W DEGREE COLLEGE,121755,College,GAIBANDHA,SUNDARGANJ,SUNDARGANJ (PART),89.5275,25.56492,715,1
DHUBNI KANCHIBARI COLLEGE,121760,College,GAIBANDHA,SUNDARGANJ,KANCHIBARI,89.51136,25.55875,716,1
BAMANDANGA ABDUL HAQUE COLLEGE,121756,College,GAIBANDHA,SUNDARGANJ,MANMATHA,89.42444,25.56275,717,1
RAMDEB SHAIKH KHABIR UDDIN COLLEGE,121753,College,GAIBANDHA,SUNDARGANJ,TALUK RAMDEB,89.45603,25.56083,718,1
SHOBHAGANJ WOMEN'S MODEL COLLEGE,121763,College,GAIBANDHA,SUNDARGANJ,KHAMAR PANCHGACHHI,89.56228,25.48233,719,1
SOBHAGANJ DEGREE COLLEGE,121758,College,GAIBANDHA,SUNDARGANJ,UTTAR MARUADAHA,89.55075,25.50031,720,1
DUBNI MOHILA COLLEGE,121761,College,GAIBANDHA,SUNDARGANJ,SATIRJAN,89.62567,25.51497,721,1
BAZARPARA COLLEGE,121762,College,GAIBANDHA,SUNDARGANJ,BAZAR PARA,89.5255,25.48431,722,1
DHARMAPUR ABDUL JABBAR DEGREE COLLEGE,121754,College,GAIBANDHA,SUNDARGANJ,DHARMAPUR,89.59925,25.4585,723,1
DHARMAPUR WOMENS COLLEGE,131930,College,GAIBANDHA,SUNDARGANJ,DHARMAPUR,89.62489,25.42222,724,1
GOBINDAGANJ  MAHILA COLLEGE,121349,College,GAIBANDHA,GOBINDAGANJ,BOALIA,89.36531,25.10872,725,1
GOBINDA GONJ COLLEGE,121347,College,GAIBANDHA,GOBINDAGANJ,BARDHAN KUTHI,89.40317,25.12464,726,1
FULPUKURIYA  COLLEGE,121353,College,GAIBANDHA,GOBINDAGANJ,SREEPUR,89.34489,25.11528,727,1
EKRAMUL HAQUE IDEAL AND COMPUTER BIGGYAN COLLEGE,121354,College,GAIBANDHA,GOBINDAGANJ,MASTA,89.39219,25.09639,728,1
KAMDIA NURUL HAQUE DEGREE COLLEGE,121351,College,GAIBANDHA,GOBINDAGANJ,PAKA,89.24553,25.20633,729,1
MOHIMAGANJ  COLLEGE,121350,College,GAIBANDHA,GOBINDAGANJ,JIRAI,89.46106,25.12747,730,1
MAHIMAGANJ WOMEN'S COLLEGE,121346,College,GAIBANDHA,GOBINDAGANJ,SREEPATIPUR,89.48256,25.13297,731,1
NAKAI HAT COLLEGE,121344,College,GAIBANDHA,GOBINDAGANJ,NAKAI,89.46642,25.23392,732,1
SHAHARGACHHI ADARSA  DEGRKEE COLLEGE,121352,College,GAIBANDHA,GOBINDAGANJ,RAJAS,89.27989,25.16442,733,1
BADIAKHALI STATION ALIM MADRASha,121165,Madrasha,GAIBANDHA,GAIBANDHA SADAR,TALUK RIFAITPUR,89.525,25.39308,4742,1
MODYA DHAN GHORA DAKHIL MADRASHA,121174,Madrasha,GAIBANDHA,GAIBANDHA SADAR,DHANGHARA (PART),89.49356,25.34803,4743,1
BALLAMJHAR AMINIA DAKHIL MADRASHA,121164,Madrasha,GAIBANDHA,GAIBANDHA SADAR,BALLAMJHAR,89.50586,25.32256,4744,1
DARUL HUDA alim MADRASHA,121181,Madrasha,GAIBANDHA,GAIBANDHA SADAR,JOTGAUR SARKAR,89.62114,25.36856,4745,1
FOLIA PULBANDI DAKHIL MADRASHA,121161,Madrasha,GAIBANDHA,GAIBANDHA SADAR,PHALIA,89.56744,25.28936,4746,1
GHAGOA  ISLAMIA  DAKHIL  MADRASHA,121166,Madrasha,GAIBANDHA,GAIBANDHA SADAR,DAKSHIN GHAGOA,89.56942,25.38919,4747,1
KHOLAHATI KORBANIA SIDDIKIA DAKHIL MADRASA,121177,Madrasha,GAIBANDHA,GAIBANDHA SADAR,PURBA KAMARNAI (PART),89.61992,25.35853,4748,1
GAIBANDHA SI. FAZIL MADRASHA,121163,Madrasha,GAIBANDHA,GAIBANDHA SADAR,DAKSHIN CHAK MOMRAJPU,89.63039,25.39169,4749,1
CHAPADAHA  ATIM  KHANA DAKHIL  MADRASHA,121172,Madrasha,GAIBANDHA,GAIBANDHA SADAR,CHAPADAHA,89.51014,25.37756,4750,1
KUPTALA  AMINIA  DAKHIL  MADRASHA,121162,Madrasha,GAIBANDHA,GAIBANDHA SADAR,KUPTALA,89.51703,25.38356,4751,1
RAMPRASAD ISLAMIA DAKHIL MADRAShA,121179,Madrasha,GAIBANDHA,GAIBANDHA SADAR,BERADANGA,89.52544,25.39194,4752,1
HAT  LAKMIPUR  ABUL  KASHEM  DAKHIL  MADRASHA,121170,Madrasha,GAIBANDHA,GAIBANDHA SADAR,GOBINDAPUR,89.53814,25.32883,4753,1
ADARSHA DE MUKHI DAKHIL MADRASHA,121176,Madrasha,GAIBANDHA,GAIBANDHA SADAR,DAVID CO. PARA,89.558,25.432,4754,1
LENGA BAZAR ADARASH DAKHIL MADRASAH,121178,Madrasha,GAIBANDHA,GAIBANDHA SADAR,MALIBARI,89.54925,25.39833,4755,1
NUTAN BANDAR GIRLS DAKHIL MADRASHA,121175,Madrasha,GAIBANDHA,GAIBANDHA SADAR,BARA BALDIA,89.54422,25.33242,4756,1
KAMARJANI BONIK FAZIL MADRASAH,121171,Madrasha,GAIBANDHA,GAIBANDHA SADAR,KISMAT MALIBARI DHARM,89.61867,25.40494,4757,1
KHIDIR SHARIF AL WAHEDI DAKHIL MADRASHA,121169,Madrasha,GAIBANDHA,GAIBANDHA SADAR,KHIDIR,89.5985,25.41825,4758,1
MATHER BAZAR ABU BAKER FAZIL degree MADRASA,121403,Madrasha,GAIBANDHA,PALASHBARI,CHHOTA BAULER PARA,89.38903,25.24575,4759,1
ROWSHON BAGH DIMUKHI DAKIL MAADRASHA,121411,Madrasha,GAIBANDHA,PALASHBARI,KRISHNAPUR,89.44703,25.30417,4760,1
HARINATHPUR POCHIMPARA DR.T.I.M  FAZLI RABBI DAKHIL MADRASHA,121414,Madrasha,GAIBANDHA,PALASHBARI,HARINATHPUR,89.46181,25.30964,4761,1
DOULATPUR B.L. ALIM MADRASHA,121410,Madrasha,GAIBANDHA,PALASHBARI,DAULATPUR,89.50514,25.23892,4762,1
MARIR HAT DEMUKHI FAZIL MADRASHA,121406,Madrasha,GAIBANDHA,PALASHBARI,LAKSHMIPUR,89.31064,25.23119,4763,1
ASMATPUR ADARSHA GIRLS DAKHIL MADRASHA,121402,Madrasha,GAIBANDHA,PALASHBARI,ASMATPUR,89.31625,25.27508,4764,1
PACH PIRER DARGAH DAKHIL MADRASHA,121412,Madrasha,GAIBANDHA,PALASHBARI,BUZRUK TENGRA,89.28347,25.29339,4765,1
PASHIM MIRJAPUR B.L FAZIL MADRASHA,121405,Madrasha,GAIBANDHA,PALASHBARI,PASCHIM MIRZAPUR,89.32492,25.29583,4766,1
CHAKBALA ALIMUDDIN DAKHIL MADASHA,121413,Madrasha,GAIBANDHA,PALASHBARI,CHAKBALA,89.30486,25.25869,4767,1
JALAgARI DARGAHPUR DAKHIL MADRASHA,121409,Madrasha,GAIBANDHA,PALASHBARI,JALAGARI DURGAPUR,89.27242,25.27856,4768,1
THOTIA PUKUR ALHAZZ AKRAM UDDIN DAKHIL MADRASHA,121416,Madrasha,GAIBANDHA,PALASHBARI,DAYAR PARA,89.33156,25.22581,4769,1
MONOHARPUR ADARSHA DAKHIL MADRASHA,121423,Madrasha,GAIBANDHA,PALASHBARI,MANOHARPUR,89.41044,25.27103,4770,1
ALLAHR DARGAH ISLAMIA DAKIL MADRASHA,121420,Madrasha,GAIBANDHA,PALASHBARI,BALA BAMANIA,89.49486,25.26797,4771,1
MAYMANTAPUR RUHUL AMIN BL le TAREL DAKHIL MADRSHA,121408,Madrasha,GAIBANDHA,PALASHBARI,MAYMANTAPUR,89.44806,25.25219,4772,1
GREEDHARIPUR DHAKIL MADRASHA,121417,Madrasha,GAIBANDHA,PALASHBARI,GIRIDHARIPUR,89.35175,25.27903,4773,1
PALASHBARI A A S B P GIRLS FAZIL MADRASHA,121404,Madrasha,GAIBANDHA,PALASHBARI,JAMALPUR,89.36372,25.28431,4774,1
MOHESHPUR DAKHIL MADRASah,121418,Madrasha,GAIBANDHA,PALASHBARI,MAHESHPUR,89.34775,25.2815,4775,1
PALASHBARI FAZIL (DEGREE ) MADRASHA,121407,Madrasha,GAIBANDHA,PALASHBARI,NUNIAGARI,89.34547,25.29986,4776,1
BADLAGARI PURBO PARA ADARSAH DAKHIL MADRASAH,121534,Madrasha,GAIBANDHA,SADULLAPUR,BADLAGARI,89.46775,25.38903,4777,1
ISLAMPUR GIRLS  DAKHIL MADRASAH,121536,Madrasha,GAIBANDHA,SADULLAPUR,ISLAMPUR,89.46114,25.37058,4778,1
SADULLAPUR GIRLS DAKHIL MADRASHA,121527,Madrasha,GAIBANDHA,SADULLAPUR,SADULLAHPUR,89.45139,25.36236,4779,1
JOYINPUR GARARMATH AZIZUL ISLAM DAKHIL MADRASHA,121513,Madrasha,GAIBANDHA,SADULLAPUR,JAYENPUR,89.46644,25.39083,4780,1
TRIMILON DARUL HUDA DAKHIL MADRASHA,121517,Madrasha,GAIBANDHA,SADULLAPUR,BHATGRAM,89.42361,25.36425,4781,1
KHORODRUHIA DARUL ULUM DAKHIL MADRASAH,121514,Madrasha,GAIBANDHA,SADULLAPUR,KHURDA RUHIA,89.46417,25.38675,4782,1
KRISNAPUR DIMOKI DAKHIL MADRASAH,121511,Madrasha,GAIBANDHA,SADULLAPUR,KRISHNAPUR,89.40817,25.36214,4783,1
NEYAMAT NAGAR N.U. SHAH S.R. FAZIL MADRASH,121508,Madrasha,GAIBANDHA,SADULLAPUR,JAMUDANGA,89.46586,25.46011,4784,1
JAMU DANGA ADARSHA BL DAKHIL MADRASHA,121528,Madrasha,GAIBANDHA,SADULLAPUR,JAMUDANGA,89.45517,25.42572,4785,1
KISHAMAT KHAJU G.M.B. BI-LATERAL DAKHIL MADRASAH,121510,Madrasha,GAIBANDHA,SADULLAPUR,KISMAT KHEJU,89.46875,25.41542,4786,1
PASCHIM DAMODARPUR DHAMUKI DAKHIL MADRASHA,121512,Madrasha,GAIBANDHA,SADULLAPUR,DAMODARPUR,89.46881,25.41547,4787,1
BOKSHIGONJ DEEMUKHI DAKHIL MADRASHA,121518,Madrasha,GAIBANDHA,SADULLAPUR,BOALIDAHA,89.38406,25.36186,4788,1
MADHYA PARA DAKHIL MADRASHA,121524,Madrasha,GAIBANDHA,SADULLAPUR,MADHYAPARA,89.36917,25.34317,4790,2
SAIGARI GOBINDPUR DAKHIL MADRASHA,121501,Madrasha,GAIBANDHA,SADULLAPUR,GOBINDAPUR,89.36917,25.34317,4791,2
ISABPUR B.L ISLAMIA DHAKIL MADRASHA,121496,Madrasha,GAIBANDHA,SADULLAPUR,ISABPUR,89.34917,25.35906,4792,1
SHAHZALAL DAKHIL MADRASA,121519,Madrasha,GAIBANDHA,SADULLAPUR,MAHESHPUR,89.40542,25.37356,4793,1
DHARAI sarifunnesa DAKHKIL MADRASAh,121504,Madrasha,GAIBANDHA,SADULLAPUR,DHARAI,89.39231,25.32803,4794,1
EDILPUR DIMUKHI DAKHIL MADRASHA,121497,Madrasha,GAIBANDHA,SADULLAPUR,IDILPUR,89.39181,25.30989,4795,1
KUNJA  MOHIPUR  BALIKA  DAHKIL  MADRSHA,121506,Madrasha,GAIBANDHA,SADULLAPUR,KUNJA MAHIPUR,89.38269,25.31064,4796,1
TARAF SADULLA SAFARIA DE MUKHI DAKHIL MADRASHA,121505,Madrasha,GAIBANDHA,SADULLAPUR,TARAF SADULLAH,89.36969,25.32414,4797,1
MOHIPUR BAZER A K BALIK  DDHKIL  MADRSHA,121507,Madrasha,GAIBANDHA,SADULLAPUR,MAHIPUR,89.38283,25.31169,4798,1
BARA JAMALPUR SENIOR MADRASHA,121515,Madrasha,GAIBANDHA,SADULLAPUR,BARA JAMALPUR,89.38283,25.31075,4799,1
CHALK SHALAI PUR SINIOR ALIM MADRASAH,121522,Madrasha,GAIBANDHA,SADULLAPUR,GOPALPUR,89.41994,25.40358,4800,1
BUZRUK RASHULPUR DAKHIL MADRASHA,121529,Madrasha,GAIBANDHA,SADULLAPUR,BUZRUK RASULPUR,89.44108,25.39547,4801,1
DHOL BHANGA BL DDAKHIL MADRASA,121500,Madrasha,GAIBANDHA,SADULLAPUR,BARA GOPALPUR,89.43203,25.41639,4802,1
KHORDA KUMARPUR HAMIDA CHOWDHURY DAKHIL MADRASA,121521,Madrasha,GAIBANDHA,SADULLAPUR,KHORDA KAMARPUR,89.43525,25.42092,4803,1
DAKKIN HAT BAMONI N.I. DHAKHIL MADRASHA,121516,Madrasha,GAIBANDHA,SADULLAPUR,HATBAMNI,89.42525,25.32867,4804,1
KISHAMAT BAGCHI SIDDIQUIA DI-MUKHI SENIOR MADRASHA,121499,Madrasha,GAIBANDHA,SADULLAPUR,KESALIDANGA,89.41914,25.30175,4805,1
KHAMAR DASLIA  SENIOR ALIM  MADRASHA,121498,Madrasha,GAIBANDHA,SADULLAPUR,KHAMAR DASALIA,89.49836,25.41736,4806,1
NALDANGA DAKHIL MADRASHA,121509,Madrasha,GAIBANDHA,SADULLAPUR,KHAMAR DASALIA,89.49858,25.4175,4807,1
RASULPUR ISLAMIA DHAKIL MADRASHA,121502,Madrasha,GAIBANDHA,SADULLAPUR,RASULPUR,89.46614,25.35442,4808,1
BASANIA PARA  AYEN MALLIK  DAKHIL MADRASAH,121533,Madrasha,GAIBANDHA,SADULLAPUR,RASULPUR,89.42086,25.43336,4809,1
TARAF KAMAL ADARSH SINIOR (ALIM) MADRASHA,121531,Madrasha,GAIBANDHA,SADULLAPUR,TARAF KAMAL,89.428,25.46453,4810,1
FULCHARI SENIOR ALIM MADRASHA,121091,Madrasha,GAIBANDHA,FULCHHARI,GAZARIA,89.41653,25.43864,4811,1
KANCHI PARA KHABIRIA dhakil MADRASAH,121088,Madrasha,GAIBANDHA,FULCHHARI,KANCHI PARA,89.59281,25.18728,4812,1
DAKKIN BURAIL ADARSHA DAKHIL MADRASHA,121090,Madrasha,GAIBANDHA,FULCHHARI,BURAIL,89.60011,25.31458,4813,1
CHIKIRPATAL RAHAMANIA DAKHIL MADRASAH,121092,Madrasha,GAIBANDHA,FULCHHARI,KALASONA,89.57581,25.25053,4814,1
RATANPUR RAHMANIA DAKHIL MADRASHA,121093,Madrasha,GAIBANDHA,FULCHHARI,RATANPUR,89.57906,25.27283,4815,1
TENGRA KANDI M A SABUR DAKHIL MADRASHA,121089,Madrasha,GAIBANDHA,FULCHHARI,TENGRAKANDI,89.57192,25.25114,4816,1
KHATIAMARI NAZATIA DHAKIL MADRASAH,121087,Madrasha,GAIBANDHA,FULCHHARI,KHATIAMARI,89.60339,25.2585,4817,1
CHITHULIA DIGHAR MUHIYA SUNNAH ALIM MADRASH,121173,Madrasha,GAIBANDHA,GAIBANDHA SADAR,CHITHALIA DIGAR,89.59883,25.252,4818,1
BONAR PARA M U ALIM MADRASHA,121592,Madrasha,GAIBANDHA,SAGHATA,SHIMULTARI (UZ.H.Q.),89.56653,25.21492,4819,1
CHINIR POTAL MOHILA DAKHIL MADRASAH,121607,Madrasha,GAIBANDHA,SAGHATA,CHINIRPATAL,89.57167,25.12175,4820,1
MATHERPARA DAKHIL  MADRASAH,121593,Madrasha,GAIBANDHA,SAGHATA,MATHAR PARA,89.55494,25.13625,4821,1
GOBINDAPUR DAKHIL MADRASAH,121601,Madrasha,GAIBANDHA,SAGHATA,GOBINDAPUR,89.57094,25.13075,4822,1
KANAIPARA DAKHIL MADRASHA,121588,Madrasha,GAIBANDHA,SAGHATA,HALDIA,89.54214,25.13383,4823,1
THAIKARER PARA DAKHIL MADRASAH,121606,Madrasha,GAIBANDHA,SAGHATA,THAIKARER PARA,89.55797,25.08272,4824,1
JUMaR BARI JANGAILA DAKHIL MADRASAH,121599,Madrasha,GAIBANDHA,SAGHATA,CHAND PARA,89.56361,25.06008,4825,1
GASABARI PURBO PARA DAKHIL MADRASHA,131596,Madrasha,GAIBANDHA,SAGHATA,BURUNGI,89.51597,25.11569,4826,1
KACHUA ALIM MADRASHA,121595,Madrasha,GAIBANDHA,SAGHATA,KACHUA,89.49114,25.15256,4827,1
SATITALA DAKhIL MADRASHA,121596,Madrasha,GAIBANDHA,SAGHATA,SATITALA,89.59325,25.13706,4828,1
OSMANERPARA DAKHIL MADRASHA,121600,Madrasha,GAIBANDHA,SAGHATA,OSMANER PARA,89.53203,25.13264,4829,1
ULASONATALA AFZALUR RABBI DAKHIL MADRASHA,121602,Madrasha,GAIBANDHA,SAGHATA,ULIA SONATALA,89.53167,25.13397,4830,1
FOLIA DIGOR BOTTOLA DAKHIL MADRASAH,121590,Madrasha,GAIBANDHA,SAGHATA,PHALIA DIGAR,89.51261,25.10028,4831,1
MONGLAR PARA DAKHIL MADRASHA,121594,Madrasha,GAIBANDHA,SAGHATA,KAICHARA,89.51264,25.11356,4832,1
SUZAL PUR ADARSHA MOHILA DAKHIL MADRASAH,121586,Madrasha,GAIBANDHA,SAGHATA,SUJALPUR,89.52997,25.12889,4833,1
SHAGHATA HEAD QUARTER DR SELIMA SAYED DAKIL MADRASHA,121587,Madrasha,GAIBANDHA,SAGHATA,SAGHATA,89.55203,25.21753,4834,2
KHAMAR DHANARuHA DAKHIL MADRASHA,121591,Madrasha,GAIBANDHA,SAGHATA,KHAMAR DHANARUHA,89.58694,25.16847,4835,1
NASIR UDDIN PRODHAN DAKHIL MADRASHA,121598,Madrasha,GAIBANDHA,SAGHATA,SHYAMPUR,89.57428,25.14822,4836,1
CHACHIA MIRGONJ A.R. ASHRAFIA DAKHIL MADRASA,121722,Madrasha,GAIBANDHA,SUNDARGANJ,CHACHIA MIRGANJ (PART),89.57375,25.14539,4837,1
CHACHIA MIRGONJ BALIKA DAKHIL MADRASA,121733,Madrasha,GAIBANDHA,SUNDARGANJ,CHACHIA MIRGANJ (PART),89.54983,25.16042,4838,1
SUNDARGANJ SADAR bahumukhi DAKHIL MADRASHA,121737,Madrasha,GAIBANDHA,SUNDARGANJ,SUNDARGANJ (PART),89.50625,25.59361,4839,1
SUNDAR GONJ SADAR MOHILA  DHAKIL MADRASHA,121751,Madrasha,GAIBANDHA,SUNDARGANJ,HURABHAYA KHAN (PART),89.52117,25.56897,4840,1
BHURARGHAT M.U. BOHUMUKHI FAZIL MADRASHA,121703,Madrasha,GAIBANDHA,SUNDARGANJ,BAMANJAL (PART),89.51114,25.60694,4841,1
DHUMAITARI SIDDIQIA FAZIL MADRASAH,121701,Madrasha,GAIBANDHA,SUNDARGANJ,DHUMAITARI (PART),89.50981,25.55494,4842,1
FALGACHHA R.U.DAKHIL MADRASA,121700,Madrasha,GAIBANDHA,SUNDARGANJ,PHALGACHHA,89.44256,25.58053,4843,1
BAMONDANGA SARKERPARA AL-HIKMAH M. A. DAKHIL MADRASHA,121750,Madrasha,GAIBANDHA,SUNDARGANJ,TALUK PHALGACHHA,89.45636,25.57228,4844,1
MONIRAM PURBO PARA AHMMEDIA DIMOKHE DAKHIL MADRASHA,121731,Madrasha,GAIBANDHA,SUNDARGANJ,MANIRAM,89.44919,25.56544,4845,1
RAHAMANIA A.B.H. ISLAMIA DAKHIL MADRASA,121716,Madrasha,GAIBANDHA,SUNDARGANJ,RAMDHAN,89.47303,25.57722,4846,1
SATGIRI DAKHIL MADRASHA,121725,Madrasha,GAIBANDHA,SUNDARGANJ,SATGIRI,89.46139,25.58147,4847,1
BELKA BOTTALA DHAKIL MADRASHA,121741,Madrasha,GAIBANDHA,SUNDARGANJ,BELKA,89.42475,25.56167,4848,1
CHANDIPUR A.G.M. SENIOR MADRASHA,121717,Madrasha,GAIBANDHA,SUNDARGANJ,CHANDIPUR,89.58147,25.52203,4849,1
SICHA KABARATIA NASIRAN NESA DHAKIL MADRASHA,121726,Madrasha,GAIBANDHA,SUNDARGANJ,SICHA,89.63225,25.494,4850,1
UZAN BOCHAGARI ELIAS KHAN M.DAKHIL MADRASHA,121718,Madrasha,GAIBANDHA,SUNDARGANJ,UJAN BOCHAGARI,89.63483,25.50658,4851,1
MORUADAHA H.M.K. DAKHIL MADRASHA,121707,Madrasha,GAIBANDHA,SUNDARGANJ,DAKSHIN MARUADAHA,89.55669,25.47639,4852,1
MORUADHA BAGANER GAHAT ADARSHA GIRLS DAKHIL MADMRASH,121740,Madrasha,GAIBANDHA,SUNDARGANJ,DAKSHIN MARUADAHA,89.54331,25.48592,4853,1
DHAPACHILA M.U. DAKHIL MADRASHA,121715,Madrasha,GAIBANDHA,SUNDARGANJ,DAKSHIN MARUADAHA,89.55706,25.50075,4854,1
SHOVA GONJ HAZY PARA ADARSHA DAKHIL MADRASA,121749,Madrasha,GAIBANDHA,SUNDARGANJ,KHAMAR PANCHGACHHI,89.55831,25.45828,4855,1
KAMAR PANCH GACHHI DAKHIL MADRASHA,121714,Madrasha,GAIBANDHA,SUNDARGANJ,KHAMAR PANCHGACHHI,89.55425,25.49797,4856,1
PURBA SAPARHATI ISLAMIA DAKHIL MADRASHA,121748,Madrasha,GAIBANDHA,SUNDARGANJ,PURBA CHHAPARHATI,89.53661,25.48406,4857,1
KUSTARY M.H DIMUKHI DAKHIL MADRASHA,121732,Madrasha,GAIBANDHA,SUNDARGANJ,PASCHIM CHHAPARHATI,89.55558,25.48581,4858,1
BAZRA HOLDIA DHAKIL MADRASHA,121704,Madrasha,GAIBANDHA,SUNDARGANJ,BAZRA HALDIA,89.51464,25.4745,4859,1
DHOPADANGA AKANDAPARA IDEAL DAKHIL MADRASAH,121698,Madrasha,GAIBANDHA,SUNDARGANJ,UTTAR DHOPADANGA,89.52772,25.45278,4860,1
NAZIMABAD ALIM  MADRASHA,121713,Madrasha,GAIBANDHA,SUNDARGANJ,LAKHIR PARA (KHORPARA,89.61086,25.56822,4861,1
BANGLA BAZAR SIDD. DAKHIL MADRASA,121720,Madrasha,GAIBANDHA,SUNDARGANJ,CHAR HARIPUR,89.60967,25.47978,4862,1
BAZRA KANCHIBARI MAZIDIA DAKHIL MADRASHA,121711,Madrasha,GAIBANDHA,SUNDARGANJ,BAJRA KANCHIBARI,89.6135,25.56725,4863,1
DHUBNI KANCHIBARI ABDUL HAFIZ DAKHIL MADRASHA,121738,Madrasha,GAIBANDHA,SUNDARGANJ,KANCHIBARI,89.61064,25.45556,4864,1
BAZARPARA KAKAI KASHDAHA DAKHIL MADRASA,121710,Madrasha,GAIBANDHA,SUNDARGANJ,BAZAR PARA,89.50781,25.49608,4865,1
NIZPARA ADARSHA ISLAMIA GIRLS DAKHIL MADRASA,121739,Madrasha,GAIBANDHA,SUNDARGANJ,RAMJIBAN,89.51547,25.50964,4866,1
RAMJIBON ISLAMIA DAKHIL MADRASHA,121706,Madrasha,GAIBANDHA,SUNDARGANJ,RAMJIBAN,89.49989,25.50725,4867,1
PANCHGACHI SANTIRAM BALIKA DAKHIL MADRASAH,121744,Madrasha,GAIBANDHA,SUNDARGANJ,PANCHGACHHI SHANTIRAM,89.56894,25.50764,4868,1
PARAN KASAR ALI DAKHIL MADRASHA,121728,Madrasha,GAIBANDHA,SUNDARGANJ,PARAN,89.57758,25.48189,4869,1
SANTIRAM DAKIL MADRASHA,121708,Madrasha,GAIBANDHA,SUNDARGANJ,SHANTIRAM,89.54197,25.51003,4870,1
AMGANJ K.T. HOSSAIN SENIOR MADRASHA,121721,Madrasha,GAIBANDHA,SUNDARGANJ,BACHH HATI,89.55339,25.51047,4871,1
AZEPARA DAKHIL MADRASAH,121709,Madrasha,GAIBANDHA,SUNDARGANJ,TALUK SAHABAJ,89.58686,25.51269,4872,1
TALUK SARBANANDA K. I. DAKHIL MADRASHA,121719,Madrasha,GAIBANDHA,SUNDARGANJ,TALUK SARBANANDA,89.47267,25.51817,4873,1
KHANBARI M.U. DAKHIL MADRASA,121712,Madrasha,GAIBANDHA,SUNDARGANJ,TALUK RAMBHADRA,89.44586,25.50175,4874,1
SONARHAT DARUL ULUM DAKHIL MADRASA,121705,Madrasha,GAIBANDHA,SUNDARGANJ,SONAROY,89.46597,25.53694,4875,1
BOALI DARUL ULUM FAZIL MADRASAH,121702,Madrasha,GAIBANDHA,SUNDARGANJ,BOALIA,89.48486,25.56853,4876,1
DAKHIN SREEPUR SAKHER BAZAR DAKHIL MADRASA,121743,Madrasha,GAIBANDHA,SUNDARGANJ,DAKSHIN SREEPUR,89.48658,25.54961,4877,1
DAKHIN SHIRIPUR KURUBADA ISLAMIA GIRLS DHAKIL MADRASHA,121745,Madrasha,GAIBANDHA,SUNDARGANJ,DAKSHIN SREEPUR,89.58483,25.46133,4878,1
DHARMAPUR MATHERHAT AL-HERA DHAKIL MADRASHA,121723,Madrasha,GAIBANDHA,SUNDARGANJ,DHARMAPUR,89.58539,25.4615,4879,1
SARA KUTI AL-WAHEDIA BL. DAKHIL MADRASAH,121730,Madrasha,GAIBANDHA,SUNDARGANJ,DHARMAPUR,89.61058,25.42939,4880,1
UTTAR SREEPUR A.SATTAR DAKHIL MADRASHA,121727,Madrasha,GAIBANDHA,SUNDARGANJ,UTTAR SREEPUR,89.60689,25.43097,4881,1
GOLAPBAG ALIM MADRASHA,121303,Madrasha,GAIBANDHA,GOBINDAGANJ,GOBINDAPUR DAKSHIN,89.51936,25.59022,4882,1
KHALSHI DAKHIL MADRASHA,121320,Madrasha,GAIBANDHA,GOBINDAGANJ,KHALSI UTTAR,89.39028,25.15236,4883,1
GOLAPBAG MOHILA DAKHIL MADRASHA,121330,Madrasha,GAIBANDHA,GOBINDAGANJ,BARDHAN KUTHI,89.38733,25.13436,4884,1
BISHU BARI DAKHIL MADRASA,121305,Madrasha,GAIBANDHA,GOBINDAGANJ,BISUBARI,89.33769,25.20642,4885,1
GOBINDA PUR MOKABBERA  B L DIMUKHI DAKHIL MADRASAH,121297,Madrasha,GAIBANDHA,GOBINDAGANJ,NALDANGA GOBINDAPUR,89.37156,25.23761,4886,1
FULBARI DHAKHIL MADRASHA,121333,Madrasha,GAIBANDHA,GOBINDAGANJ,DIGHALI PHULBARI,89.36483,25.23583,4887,1
FULPUKURIA M.U. ALIM MADRASAH,121298,Madrasha,GAIBANDHA,GOBINDAGANJ,CHAK KOCHMARI,89.39711,25.16975,4888,1
KRISNAPUR CHAYGHARIA SHAH HANNANIA DAKHIL MADRASHA,121311,Madrasha,GAIBANDHA,GOBINDAGANJ,KRISHNAPUR CHHAYGHARI,89.30933,25.12772,4889,1
SUNDARKOL HAZRAT FATIMA(R) BALIKA DAKIL MADRASHA,121329,Madrasha,GAIBANDHA,GOBINDAGANJ,SUNDARKOL,89.36433,25.14619,4890,1
BARADAH DAKHIL MADRASAH,121335,Madrasha,GAIBANDHA,GOBINDAGANJ,BARADAHA,89.46897,25.19128,4891,1
HORIPUR SHOUR VINIA DAKHIL MADRASAH,121313,Madrasha,GAIBANDHA,GOBINDAGANJ,UTTAR HARIPUR,89.46864,25.1915,4892,1
CHAND PARA  SENIOR MADRASHA,121289,Madrasha,GAIBANDHA,GOBINDAGANJ,CHAND PARA,89.48247,25.19989,4893,1
CHAPRI GONJ S. M. FAZIL MADRASAH,121283,Madrasha,GAIBANDHA,GOBINDAGANJ,KAMARDAHA,89.45339,25.19058,4894,1
MOGOLTOLY SHADAWON BALIKA DAKHIL MADRASHA,121315,Madrasha,GAIBANDHA,GOBINDAGANJ,BARNA CHANDRA SEKHAR,89.46633,25.21239,4895,1
MASTA SHAMSUL HAQ DAKHIL MADRASAH,121334,Madrasha,GAIBANDHA,GOBINDAGANJ,MASTA,89.38069,25.09094,4896,1
KAMIDIA D.U.S. ALIM MADRASAH,121280,Madrasha,GAIBANDHA,GOBINDAGANJ,KAMDIA,89.38647,25.08914,4897,1
AL-HAZ AHMAD ALI DAKHIL MADRASHA,121327,Madrasha,GAIBANDHA,GOBINDAGANJ,TEGHARA,89.38278,25.09311,4898,1
BOGDOHO ISLMIA B.L. DAKHIL MADRASAH,121323,Madrasha,GAIBANDHA,GOBINDAGANJ,BOGDAHA,89.21453,25.20981,4899,1
KATHAL BARI MOSTAFIA B.L SENIOR FAZIL MADRASHA,121290,Madrasha,GAIBANDHA,GOBINDAGANJ,KANTHALBARI,89.22483,25.20433,4900,1
NASIRABAD ADARSHA DAKHIL MADRASHA,121342,Madrasha,GAIBANDHA,GOBINDAGANJ,KATABARI,89.27592,25.19981,4901,1
AFROZA ANAR DAKHIL MADRASAH,121331,Madrasha,GAIBANDHA,GOBINDAGANJ,ARAZI SAHAPUR,89.44603,25.17392,4902,1
HARIPUR ISLAMIA DAKHIL MADRASA,121325,Madrasha,GAIBANDHA,GOBINDAGANJ,HARIPUR,89.41378,25.09236,4903,1
DHARMAPUR ISLAMIA DAKHIL MADRASHA,121285,Madrasha,GAIBANDHA,GOBINDAGANJ,DHARMAPUR,89.39992,25.08872,4904,1
JAGANNATHPUR DAKHIL MADRASHA,121312,Madrasha,GAIBANDHA,GOBINDAGANJ,JAGANNATHPUR,89.39803,25.08883,4905,1
PANCHA GRAM RAISIA DAKHIL MADRASAH,121304,Madrasha,GAIBANDHA,GOBINDAGANJ,PEPULIA,89.43431,25.07578,4906,1
BALUA TAMIZ UDDIN AHMADIA DAKHIL MADRASHA,121307,Madrasha,GAIBANDHA,GOBINDAGANJ,BALUA,89.48458,25.13111,4907,1
ALHAZ ASAB ALI KAMIL MADRASHA,121316,Madrasha,GAIBANDHA,GOBINDAGANJ,JAGADISHPUR,89.49183,25.1035,4908,1
MAHIMAGONJ KAMIL MADRASHA,121277,Madrasha,GAIBANDHA,GOBINDAGANJ,JIRAI,89.48089,25.11186,4909,1
PUNTAIR AGPARA MOHILA DHAKIL MADRASHA,121321,Madrasha,GAIBANDHA,GOBINDAGANJ,PANTAIR,89.48728,25.10742,4910,1
DUMUR GASHA SIDDKIA B/ L DAKHIL MADRASHA,121301,Madrasha,GAIBANDHA,GOBINDAGANJ,DUMURGACHHA,89.48769,25.11072,4911,1
KHUKSHIA BL  DAKHIL MADRASHA,121309,Madrasha,GAIBANDHA,GOBINDAGANJ,KHUKSIA,89.47847,25.10772,4912,1
POGAIL B.L. DAKHIL MADRASAH,121300,Madrasha,GAIBANDHA,GOBINDAGANJ,POGAIL,89.45433,25.21331,4913,1
RAZA BIRAT B L  DAKHIL MADRASHA,121328,Madrasha,GAIBANDHA,GOBINDAGANJ,BARATTA,89.44103,25.19825,4914,1
BANESWAR BAHARUL ULUM NOMANIA DAKHIL MADRASHA,121286,Madrasha,GAIBANDHA,GOBINDAGANJ,BANESHWAR,89.24811,25.14942,4915,1
BEUR GRAM DAKHIL MADRSHA,121302,Madrasha,GAIBANDHA,GOBINDAGANJ,BEURGRAM,89.45392,25.21094,4916,1
DHANIAL LATIFIA DAKHIL MADRASHA,121291,Madrasha,GAIBANDHA,GOBINDAGANJ,DHANIAL,89.26894,25.12053,4917,1
PANITALHAT ISLAMIA DAKHIL MADRASHA,121278,Madrasha,GAIBANDHA,GOBINDAGANJ,SIHIPUR,89.28178,25.10547,4918,2
DOGHARIA DARUS SUNNAH MOZIDIA DAKHIL MADRASHA,121296,Madrasha,GAIBANDHA,GOBINDAGANJ,DOGHARIA,89.24289,25.147,4919,1
CHOTO AVIRAMPUR PASCHIM PARA DAKHIL MADRASHA,121326,Madrasha,GAIBANDHA,GOBINDAGANJ,CHHOTA ABHIRAMPUR,89.29169,25.12631,4920,1
RAKHAL  BURUZE MUNSHIRHAT KERAMOTIA ALIM MADRASHA,121281,Madrasha,GAIBANDHA,GOBINDAGANJ,RAKHAL BURUZ,89.45825,25.15086,4921,1
KAZLA MOHILA DAKHIL MADRASHA,121337,Madrasha,GAIBANDHA,GOBINDAGANJ,KAJLA,89.47192,25.15089,4922,1
BAROPAIKA DAKHIL MADRASAH,121310,Madrasha,GAIBANDHA,GOBINDAGANJ,BARA PAIKA,89.45992,25.14914,4923,1
SHAKAHATI DAKHIL  MADRASHA,121314,Madrasha,GAIBANDHA,GOBINDAGANJ,SAKHAHATI,89.45569,25.17928,4924,1
SHAPMARA DARUS SALAM DAKHIL MADRASHA,121319,Madrasha,GAIBANDHA,GOBINDAGANJ,SAPMARA,89.47808,25.07597,4925,1
PONDITPUR sirajul ULUM hamidia DAKHIL MADRASHA,121294,Madrasha,GAIBANDHA,GOBINDAGANJ,PANDITPUR,89.28447,25.16475,4926,1
ALIGRAM AHAMMADIA  DAKHIL MADRASHA,121293,Madrasha,GAIBANDHA,GOBINDAGANJ,ALIGAON,89.34308,25.16819,4927,1
AYEZABAD MAZIDIA FAZIL MADRASHA,121295,Madrasha,GAIBANDHA,GOBINDAGANJ,AYABHANGI,89.30075,25.15286,4928,1
BAIRAGIRHAT BAT TALA DAKHIL MADRASHA,121332,Madrasha,GAIBANDHA,GOBINDAGANJ,BATTALA,89.27356,25.16589,4929,1
KHARITA DAKHIL MADRASHA,121287,Madrasha,GAIBANDHA,GOBINDAGANJ,HAITAR,89.26875,25.14322,4930,1
DASHLAL M.U B L.   DAKHIL MADRASHA,121292,Madrasha,GAIBANDHA,GOBINDAGANJ,DASNAL,89.20933,25.17931,4931,1
SHAHARGACHI ADARSHA  ALIM MADRASHA,121324,Madrasha,GAIBANDHA,GOBINDAGANJ,RAJAS,89.29189,25.134,4932,1
SHIBPUR FOZORIA FAZIL MADRASHA,121284,Madrasha,GAIBANDHA,GOBINDAGANJ,SHIBPUR,89.25397,25.14975,4933,1
