inst name, eiin, inst_type, district, thana, mauza, long, lat, serial,isUnique
GOVT. H.S.S. COLLEGE, MAGURA,118003,College,MAGURA,MAGURA SADAR,COLLEGE PARA,89.418945,23.488811,1264,1
AMORESH BOSU DEGREE MOHABIDAYLAYA,118006,College,MAGURA,MAGURA SADAR,BARUNTAIL,89.41983,23.485466,1265,1
BIHARILAL SHIKDER MAHABIDDYALA,118125,College,MAGURA,SHALIKHA,SINGRA,89.375488,23.302296,1266,1
MAGURA GOVT.MOHILA COLLEGE,118004,College,MAGURA,MAGURA SADAR,COLLEGE PARA,89.40131,23.49631,1267,1
HAZIPUR SAMMILANI COLLEGE,118007,College,MAGURA,MAGURA SADAR,HAJIPUR,89.455,23.53778,1268,1
MAGURA ADASHA DEGREE COLLEGE MAGURA,118005,College,MAGURA,MAGURA SADAR,COLLEGE PARA,89.38583,23.54139,1269,1
BUNAGATI DEGREE COLLEGE,118124,College,MAGURA,SHALIKHA,BUNAGATI,89.36842,23.56112,1270,1
AISA WOMENS COLLEGE,118000,College,MAGURA,MAGURA SADAR,KUKNA,89.42008,23.49007,1271,1
NAZIR AHAMAD DEGREE MAHAVIDALOY,118002,College,MAGURA,MAGURA SADAR,BHANGURA,89.39377,23.47537,1272,1
BUZRUK SREE KUNDI COLLEGE,118008,College,MAGURA,MAGURA SADAR,BUZRUK SREEKUNDI,89.48772,23.44496,1273,1
DAKHIN NOWAPARA SAMMILANI COLLEGE,131908,College,MAGURA,MAGURA SADAR,DAKSHIN NAWA PARA,89.48333,23.4184,1274,1
BABU KHALI ADARSHA COLLEGE,118062,College,MAGURA,MOHAMMADPUR,SULTANSI,89.54172,23.49236,1275,1
BINODPUR   DEGREE   COLLAGE,118065,College,MAGURA,MOHAMMADPUR,BINODEPUR,89.54819,23.42092,1276,1
AMINUR   RAHMAN   COLLEGE ,  MOHAMMADPUR,118064,College,MAGURA,MOHAMMADPUR,BAZAR RADHANAGAR,89.57337,23.40461,1277,1
KAZI SALIMA HAQUE MOHILA DEGREE COLLEGE,118063,College,MAGURA,MOHAMMADPUR,MOHAMMADPUR,89.60003,23.39845,1278,1
ARPARA DEGREE COLLEGE,118123,College,MAGURA,SHALIKHA,KANTHALBARIA,89.3352,23.38559,1279,1
ARPARA MOHILA COLLEGE,118122,College,MAGURA,SHALIKHA,PORAGACHHI,89.39524,23.30082,1280,1
BANASSREE RABINDRA SMARANI COLLEGE KRISHNABILA (TANGAKHALI),131961,College,MAGURA,MAGURA SADAR,BANSHKOTA,89.40989,23.36109,1281,1
DARIAPUR DEGREE COLLEGE,118175,College,MAGURA,SREEPUR,DARIAPUR,89.41867,23.66306,1282,1
G.K IDEAL DEGREE COLLEGE,118173,College,MAGURA,SREEPUR,GHASIARA,89.39023,23.64668,1283,1
NAKOL SAMMILONI DEGREE COLLEGE,118171,College,MAGURA,SREEPUR,NAKOL,89.50867,23.53669,1284,1
SREEPUR DEGREE COLLEGE,118174,College,MAGURA,SREEPUR,SREEPUR,89.39469,23.59092,1285,1
sreepur mohila college,118172,College,MAGURA,SREEPUR,SREEPUR,89.47081,23.52708,1286,1
MAGURA SIDDIQUIA KAMIL MADRASAH,117972,Madrasha,MAGURA,MAGURA SADAR,COURT PARA,89.33147,23.49317,6677,1
AL AMIN TRUST DAKHIL MADRASA,117973,Madrasha,MAGURA,MAGURA SADAR,DAKSHIN KARIKOR PARA,89.45181,23.50072,6678,1
BOGURA MAZAIL DAKHIL MADRASHA,117979,Madrasha,MAGURA,MAGURA SADAR,DHALFA BAGURA,89.40833,23.53444,6679,1
MODHUKHALI AMINIA DAKHIL  MADRASHA,118112,Madrasha,MAGURA,SHALIKHA,MADHUKHALI,89.42278,23.53389,6680,1
MONIRAMPUR AZIZIA DAKHIL MADRASHA,117980,Madrasha,MAGURA,MAGURA SADAR,DIGHALKANDI,89.38751,23.4843,6681,1
BEROIL DARUL HUDA SENIOR FAZIL MADRASAH,117974,Madrasha,MAGURA,MAGURA SADAR,BIRAIL PALITA,89.40645,23.47879,6682,1
CHOTO JOKA ALIM MADRASAH,117976,Madrasha,MAGURA,MAGURA SADAR,CHHOTA JOKA,89.41369,23.4829,6683,1
PUKHORIA ALOKDIA ALIM MADRASHA,117975,Madrasha,MAGURA,MAGURA SADAR,PUKHURIA,89.50568,23.37628,6684,1
BUZRUK SREE KUNDI DAKHIL MADRASHA,117986,Madrasha,MAGURA,MAGURA SADAR,BUZRUK SREEKUNDI,89.4906,23.47887,6685,1
JAGDOL RUPATI ALIM MADRASHA,117977,Madrasha,MAGURA,MAGURA SADAR,JAGDAL,89.4924,23.33355,6686,1
SAMMILONY BAHUMUKHY ALIM MADRASAH,117993,Madrasha,MAGURA,MAGURA SADAR,BIRAIL PALITA,89.4373,23.41997,6688,2
SATRUJITPUR NURUL ISLAM DAKHIL MADRASHA,117989,Madrasha,MAGURA,MAGURA SADAR,SATRUJITPUR,89.43857,23.34418,6689,1
JAGLA DAKHIL MADRASah,117996,Madrasha,MAGURA,MAGURA SADAR,JAGLA,89.38816,23.42567,6690,1
RAJPAT RAJAPUR R M A DAKHIL MADRASAH,118054,Madrasha,MAGURA,MOHAMMADPUR,RAJAPUR,89.36377,23.4279,6691,1
BABUKHALI ISLAMIA DAKHIL MADRASA,118058,Madrasha,MAGURA,MOHAMMADPUR,SULTANSI,89.55969,23.4765,6692,1
BANIABAHU KAWRA QUADERIA S.R. ALIM MADRASHA,118053,Madrasha,MAGURA,MOHAMMADPUR,PARBHAT PARA,89.50372,23.44011,6693,1
BINODPUR SHAJU BIBI DAKHIL MADRASAH,131739,Madrasha,MAGURA,MOHAMMADPUR,BINODEPUR,89.50444,23.43453,6694,1
GHULLIA DAKHIL MADRASA,118048,Madrasha,MAGURA,MOHAMMADPUR,GHULLIA,89.55017,23.45111,6695,1
NAGRIPARA ISLAMIA DAKHIL MADRASA,118056,Madrasha,MAGURA,MOHAMMADPUR,NAGRI PARA,89.50542,23.42819,6696,1
GONGARAMPUR SHADRIA DAKHIL MADRASHA,118111,Madrasha,MAGURA,SHALIKHA,GANGARAMPUR,89.52256,23.36167,6697,1
BALIDIA MAZHARUL ULUM DAKHIL MADRASHA,118052,Madrasha,MAGURA,MOHAMMADPUR,BALIDIA,89.5025,23.32806,6698,1
BALIDIA ADARSHA MOHIL DAKHIL MADRASHA,131788,Madrasha,MAGURA,MOHAMMADPUR,SREEPUR,89.49389,23.30833,6699,1
BORORIA A.W. SENOIR MADRASHA,118050,Madrasha,MAGURA,MOHAMMADPUR,BARURIA GOPALPUR,89.50444,23.325,6700,1
CHOTOKALAM DHARY DARUSSUNNA DAKHIL MADRASAH,118061,Madrasha,MAGURA,MOHAMMADPUR,CHHOTA KALAMDHARI,89.55276,23.38209,6701,1
RIZIA RUBIA MOHILA DAKHIL MADRASHA,118060,Madrasha,MAGURA,MOHAMMADPUR,GHOSHPUR,89.57831,23.37556,6702,1
JOSHPUR MOHILA DAKHIL MADRASAH,118059,Madrasha,MAGURA,MOHAMMADPUR,JASPUR,89.55319,23.36876,6703,1
MOUSHA  MOHAMMADIA  DAKHIL  MADRSAHA,118057,Madrasha,MAGURA,MOHAMMADPUR,MAUSA,89.55346,23.38501,6704,1
KASHIPUR SHINDAIN GUROSTHAN DAKHIL MADRASAH,131743,Madrasha,MAGURA,MOHAMMADPUR,BAIRAL PANCHURIA,89.55406,23.41825,6705,1
CHAKULIA S M DAKHIL MADRASA,118055,Madrasha,MAGURA,MOHAMMADPUR,CHAKULIA,89.58267,23.39953,6706,1
NOHATA  A.G FAZIL MADRASA,118051,Madrasha,MAGURA,MOHAMMADPUR,NAHATA,89.59564,23.40728,6707,1
MANDARBARIA MADENATUL AULIA OAL OLAMA DAKHIL MADRASHA,131740,Madrasha,MAGURA,MOHAMMADPUR,MANDARBARIA,89.51774,23.33572,6708,1
JHAMA BARKATUL ULUM SENIOR (FAZIL) MADRASHA,118047,Madrasha,MAGURA,MOHAMMADPUR,BHABANIPUR,89.58821,23.34405,6709,1
GARERHAT KAZI AYSA KHATUN DAKHIL MADRASHA,118106,Madrasha,MAGURA,SHALIKHA,HANSAIKHOLA,89.43722,23.32194,6710,1
PULUM  DAKHIL  MADRASHA,118121,Madrasha,MAGURA,SHALIKHA,SHALIKHA,89.42806,23.335,6711,1
KAPASHATI DAKHIL MADRASah,117982,Madrasha,MAGURA,MAGURA SADAR,KAPASHATI,89.45667,23.30722,6712,1
CHHAYGHORIA A B S FAZIL MADRASAH,118102,Madrasha,MAGURA,SHALIKHA,CHHAYGHARIA,89.45444,23.28,6713,1
HARISHPUR DAKHIL MADRASA,118107,Madrasha,MAGURA,SHALIKHA,HARISHPUR,89.45944,23.26472,6714,1
PEAR PUR ISLAMIA GIRLS  DAKHIL  MADRASHA,118109,Madrasha,MAGURA,SHALIKHA,PIARPUR,89.35463,23.40974,6715,1
SATAKHALI DARUL ULUM DAKHIL MADRASHA,118105,Madrasha,MAGURA,SHALIKHA,SHATAKHALI(PART-1),89.40137,23.3887,6716,1
PIPRUL ABDUL HAKIM MOLLICK DAKHIL MADRASAH,118103,Madrasha,MAGURA,SHALIKHA,PIPRUL,89.33406,23.34502,6717,1
BOLAI NAGHOSHA DAKHIL MADRASAH,118117,Madrasha,MAGURA,SHALIKHA,BALAI NAGHOSA,89.34962,23.33107,6718,1
UTTOR SHARUSHUNA USUFIA DAKHIL MADRASAH,118104,Madrasha,MAGURA,SHALIKHA,SARUSONA,89.31438,23.38975,6719,1
DAKHAN SHARU SHOONA DAKHIL MADRASAH,118119,Madrasha,MAGURA,SHALIKHA,SARUSONA,89.3377,23.39622,6720,1
ARPARA SADAR ALIM MADRASAH,118108,Madrasha,MAGURA,SHALIKHA,ARPARA,89.36674,23.37066,6721,1
JUNARY KHADIZATUL KUBRA(R:) DARUL ULUM MOHILA DAKHIL MADRASHA,118113,Madrasha,MAGURA,SHALIKHA,JUNARI,89.36367,23.36673,6722,1
RAJAPUR DURGAPUR SAMMILITA DAKHIL MADRASHA,118168,Madrasha,MAGURA,SREEPUR,PASCHIM RAJAPUR,89.40472,23.58208,6725,2
MADANPUR DAKHIL MADRASAH,118170,Madrasha,MAGURA,SREEPUR,MADANPUR,89.40828,23.68044,6726,1
TAKHALPUR HATEM ALI MIA DAKHIL MADRASHA,118165,Madrasha,MAGURA,SREEPUR,TAKHALPUR,89.43439,23.636,6727,1
LANGALBAND DARUL ISLAM SIDDIKIA SENIOR MADRASAH,118162,Madrasha,MAGURA,SREEPUR,LANGALBAND,89.452,23.61542,6728,1
NABAGRAM KABIR AHMMAD DAKHIL MADRASHA,118169,Madrasha,MAGURA,SREEPUR,NABAGRAM,89.45117,23.60289,6729,1
KADIR PARA SAMMILONI ISLAMIA ALIM MADRASHA,118164,Madrasha,MAGURA,SREEPUR,KADIR PARA,89.37929,23.66467,6730,1
MAZHAIL MANDARTOLA RAJDHORPUR DAKHIL MADRASAH,131747,Madrasha,MAGURA,SREEPUR,RAJDHARPUR,89.49792,23.55289,6731,1
AMTOIL J.T.S. KADERIA (R:) DAKHIL MADRASAH,118166,Madrasha,MAGURA,SREEPUR,AMTAIL,89.39597,23.59036,6732,1
NOHATA DAKHIL MADRASAH,118167,Madrasha,MAGURA,SREEPUR,NAOHATTA,89.43631,23.58286,6733,1
BARISHAT PURBAPARA DAKHIL MADRASAH,118160,Madrasha,MAGURA,SREEPUR,BARISAT,89.42142,23.56497,6734,1
KHAMAR PARA SIDDIKIA AHAMMADIA ISLAMIA ALIM MADRASHA,118163,Madrasha,MAGURA,SREEPUR,PURBA SREEKUL,89.45794,23.56578,6735,1
BELNAGAR HIGH SCHOOL,117932,School,MAGURA,MAGURA SADAR,BELNAGAR,88.61817,23.70858,18384,1
SHUVECHCHHA PREPARATORY SCHOOL, MAGURA,131419,School,MAGURA,MAGURA SADAR,COUNCIL PARA,89.45919,23.50503,18387,1
MAGURA GOVT. HIGH SCHOOL,117904,School,MAGURA,MAGURA SADAR,ADARSHA PARA,89.46058,23.50503,18388,1
FULBARI H. M. R. JUNIOR HIGH SCHOOL,117935,School,MAGURA,MAGURA SADAR,DHALFA BAGURA,89.4245,23.48139,18389,1
PASHCIM BARIALA  SIRAJUL ISLAM JUNIOR SCHOOL,117938,School,MAGURA,MAGURA SADAR,PASCHIM BARIALA,89.41186,23.48589,18390,1
BAghdANGA  SECONDARY SCHOOL,117941,School,MAGURA,MAGURA SADAR,BAGHDANGA,89.42461,23.48911,18391,1
MADHABPUR SECONDARY SCHOOL,117920,School,MAGURA,MAGURA SADAR,MADHABPUR,89.42714,23.48147,18392,1
SRIRAMPUR HIGH SCHOOL,117916,School,MAGURA,MAGURA SADAR,SREERAMPUR,89.42303,23.48878,18393,1
ARAYSHATA SECONDARY SCHOOL,117942,School,MAGURA,MAGURA SADAR,ARAISHATA,89.45694,23.53083,18395,1
MAGURA DUDH MALLIK SECONDARY GIRL'S SCHOOL,131469,School,MAGURA,MAGURA SADAR,ISLAMPUR PARA,89.33639,23.56444,18396,1
BAKHERA MOKORDOM KHOLA JUNIOR SCHOOL,118153,School,MAGURA,SREEPUR,BAKHERA,89.38833,23.55389,18397,1
SHANKAR VEDANTA MATH MISSION SECONDARY GIRLS SCHOOL,118152,School,MAGURA,SREEPUR,SREEPUR HUDA,89.41783,23.481,18398,1
JARIA SAMMILANI HIGH SCHOOL,118149,School,MAGURA,SREEPUR,JARIA,89.42644,23.48725,18399,1
CHOToFALIA HIGH SCHOOL,117971,School,MAGURA,MAGURA SADAR,CHHOTA FALIA,89.44306,23.33639,18400,1
ABAL PUR HIGH SCHOOL,117936,School,MAGURA,MAGURA SADAR,NAYA KASINATHPUR,89.46889,23.31333,18401,1
POLICE LINES HIGH SCHOOL MAGURA,117948,School,MAGURA,MAGURA SADAR,KUKNA,89.44008,23.43383,18404,1
MAGURA A.G.ACADEMY,117908,School,MAGURA,MAGURA SADAR,ZILA PARA,89.36362,23.46936,18405,2
ASIA JUNIOR GIRLS HIGH SCHOOL,117968,School,MAGURA,MAGURA SADAR,KUKNA,89.36362,23.46936,18406,2
MAGURA ADARSHA GIRLS HIGH SCHOOL,117960,School,MAGURA,MAGURA SADAR,T.T.D.C.PARA,89.40637,23.48683,18407,1
ALHAZ KAZI ABDUL WAHED SECONDARY SCHOOL,117919,School,MAGURA,MAGURA SADAR,BIRAIL PALITA,89.39359,23.48322,18408,1
ALOKDIA pUKHARIA SECONDERY SCHOOL,117917,School,MAGURA,MAGURA SADAR,ALOKDIA,89.40517,23.4797,18409,1
BOGIA SUBHASHINE BASU HIGH SCHOOL,117933,School,MAGURA,MAGURA SADAR,BAGIA NARAYANPUR,89.41432,23.48118,18410,1
 A. MOZID ACADEMY GREEHOGRAM,117957,School,MAGURA,MAGURA SADAR,GRAHAGRAM,89.49461,23.33389,18411,1
PUKURIA ALOKDIA SECONDARY GIRLS SCHOOL,117931,School,MAGURA,MAGURA SADAR,PUKHURIA,89.49518,23.33324,18412,1
DHALAHARA CHANDPUR SECONDARY SCHOOL,117951,School,MAGURA,MAGURA SADAR,DHALHARA,89.48414,23.46683,18413,1
DHALHARA WEST PARA GIRLS SCHOOL,117955,School,MAGURA,MAGURA SADAR,DHALHARA,89.47349,23.47902,18414,1
NISCHINTAPUR JUNIOR HIGH SCHOOL,117963,School,MAGURA,MAGURA SADAR,DAKSHIN NISCHINTAPUR,89.48843,23.4668,18415,1
GOALBATHAN HIGH SCHOOL,117927,School,MAGURA,MAGURA SADAR,GOAL BATHAN,89.46631,23.44218,18416,1
JOGDAL ADaRSHA JUNIOR GIRLS SCHOOL,117967,School,MAGURA,MAGURA SADAR,JAGDAL,89.45855,23.46387,18419,1
JOGDAL SAMMILONI HIGH SCHOOL,117928,School,MAGURA,MAGURA SADAR,JAGDAL,89.50194,23.39128,18420,1
KUCHIAMORA GIRLS HIGH SCHOOL,117945,School,MAGURA,MAGURA SADAR,KUCHIAMORA,89.43827,23.42056,18421,2
DAKHIN MIRZAPUR SECONDARY SCHOOL,117959,School,MAGURA,MAGURA SADAR,DAKSHIN MIRZAPUR,89.43827,23.42056,18422,2
ADORSHA SHAMMILONI SECONDARY GIRLS SCHOOL,117966,School,MAGURA,MAGURA SADAR,BARAKHARI,89.43707,23.35856,18423,1
KATAKHALI HIGH SCHOOL,117934,School,MAGURA,MAGURA SADAR,NARSHINGHATI,89.44479,23.38133,18424,1
SATTYAPUR ML.HIGH SCHOOL,117923,School,MAGURA,MAGURA SADAR,SATYIPUR,89.34582,23.46291,18425,1
TITAR KHA PARA HIGH SCHOOL,117952,School,MAGURA,MAGURA SADAR,TITAR KHAN PARA,89.50451,23.34591,18426,1
RAGHAAB DAIR HIGH SCHOOL,117956,School,MAGURA,MAGURA SADAR,RAGHAB DAIR,89.41145,23.45584,18427,1
BHABON HATI HIGH SCHOOL,117937,School,MAGURA,MAGURA SADAR,BHABANHATI,89.41157,23.44798,18428,1
JAGLA H.M. HIGH SCHOOL,117922,School,MAGURA,MAGURA SADAR,JAGLA,89.39158,23.44837,18429,1
BABUKHALI JUNIOR GIRLS SCHOOL,131114,School,MAGURA,MOHAMMADPUR,DIGHA,89.33099,23.42257,18430,1
BASHO MACHINAGRA JUNIOUR SCHOOL,131112,School,MAGURA,MOHAMMADPUR,BASO,89.36799,23.39267,18431,1
CHALIMA GIRLS SECONDARY SCHOOL,118040,School,MAGURA,MOHAMMADPUR,CHALMIA,89.39567,23.40985,18432,1
DHULAJORA  CHURARGATI P. C. HIGH SCHOOL,118016,School,MAGURA,MOHAMMADPUR,DHULJORA,89.3998,23.41609,18433,1
DUMURSHIA D.C. ML. HIGH SCHOOL,118019,School,MAGURA,MOHAMMADPUR,BASUR DHULJURI,89.53025,23.36733,18434,1
KERINAGAR S S JUNIOR SECONDARY SCHOOL,131111,School,MAGURA,MOHAMMADPUR,HATBARIA,89.56225,23.49231,18435,1
BHETHULIA GIRLS SCHOOL,118041,School,MAGURA,MOHAMMADPUR,BETHALIA,89.52039,23.4865,18436,1
BINODPUR B. K. HIGH SCHOOL,118014,School,MAGURA,MOHAMMADPUR,BINODEPUR,89.53064,23.48944,18437,1
BINODPUR NANIBALA GIRLS HIGH SCHOOO,118034,School,MAGURA,MOHAMMADPUR,BINODEPUR,89.54392,23.46697,18438,1
CHOWBARIA HIGH SCHOOL,118039,School,MAGURA,MOHAMMADPUR,CHOUBARIA,89.55883,23.48844,18439,1
KANUTIA A. ALA SECONDARY SCHOOL,118022,School,MAGURA,MOHAMMADPUR,KANUTIA,89.55981,23.48825,18440,1
KHALIA HIGH SCHOOL,118043,School,MAGURA,MOHAMMADPUR,KHALIA,89.54344,23.4245,18441,1
DIGHA INTAZ MOLLA HIGH SCHOOL,118023,School,MAGURA,MOHAMMADPUR,BIL KHANIDAHA,89.51558,23.45625,18442,1
KUMRUL HIGH SCHOOL,118042,School,MAGURA,MOHAMMADPUR,KUMRUL,89.52178,23.41831,18443,1
PALLA SECHODARY GIRLS SCHOOL,118038,School,MAGURA,MOHAMMADPUR,PALLA,89.52719,23.44558,18444,1
RArIKHALI SECONDARY SCHOOL,118030,School,MAGURA,MOHAMMADPUR,RARIKHALI,89.56964,23.44892,18445,1
RAJAPUR SECONDARY GIRLS HIGH SCHOOL,118033,School,MAGURA,MOHAMMADPUR,RAJAPUR,89.57753,23.47003,18446,1
RAJPAT SECONDRY SCHOOL,118020,School,MAGURA,MOHAMMADPUR,RAJAPUR,89.60161,23.46272,18447,1
BABUKHALI APTAB UDDIN SECONDARY SCHOOL,118028,School,MAGURA,MOHAMMADPUR,SULTANSI,89.59556,23.46683,18448,1
GANGARAMPUR P.K. SECONDARY SCHOOL,118069,School,MAGURA,SHALIKHA,GANGARAMPUR,89.59511,23.45989,18449,1
GANGARAM PUR GIRLS HIGH SCHOOL,118081,School,MAGURA,SHALIKHA,GANGARAMPUR,89.51064,23.40958,18450,1
BALIDIA  SECONDARY SCHOOL,118021,School,MAGURA,MOHAMMADPUR,BALIDIA,89.52889,23.36797,18451,1
HOREKRISHNO PUR JUNIOR HIGH SCHOOL,131147,School,MAGURA,MOHAMMADPUR,HAREKRISHNAPUR,89.56111,23.48894,18452,1
DHOAIL ADARSHA SECONDARY SCHOOL,118036,School,MAGURA,MOHAMMADPUR,DHOAIL,89.56833,23.39992,18453,1
MOHAMMADPUR GIRLS HIGH SCHOOL,118025,School,MAGURA,MOHAMMADPUR,MOHAMMADPUR,89.53532,23.39787,18454,1
R.S K.H INSTITIUTION,MOHAMODPUR,118013,School,MAGURA,MOHAMMADPUR,MOHAMMADPUR,89.56145,23.40725,18455,1
BASUR DHULJURI HIGH SCHOOL,118031,School,MAGURA,MOHAMMADPUR,BASUR DHULJURI,89.563,23.42282,18456,1
KHALI SHA KHALI HIGH SCHOOL,118018,School,MAGURA,MOHAMMADPUR,BILWA PARA,89.59931,23.44283,18457,1
NOHATA RANI PATIT PABONI HIGH  SCHOOL,118015,School,MAGURA,MOHAMMADPUR,NAHATA,89.59147,23.40013,18458,1
JOYRAMPUR SHAPTA GRAM SHAMMELONY JUNIOR HIGH SCHOOL,118045,School,MAGURA,MOHAMMADPUR,JOYRAMPUR,89.59333,23.40097,18459,1
BONGRAM K.M.S. SECONDARY SCHOOL,118032,School,MAGURA,MOHAMMADPUR,PALASHBARIA,89.52021,23.33741,18460,1
JHAMA HIGH SCHOOL,118024,School,MAGURA,MOHAMMADPUR,NARIKELBARIA,89.53052,23.33765,18462,1
PALASH BARIA SECONDARY SCHOOOL,118044,School,MAGURA,MOHAMMADPUR,PALASHBARIA,89.51974,23.33708,18463,1
JESSOBANTO PUR HIGH SCHOOL,118027,School,MAGURA,MOHAMMADPUR,JASUMANTAPUR,89.57719,23.33329,18464,2
NANDUALI D.U. SECONDARY SCHOOL,117905,School,MAGURA,MAGURA SADAR,PASCHIM NANDUALI,89.57785,23.35853,18465,1
BAULIA NIROD KRISHNA SECONDARY SCHOOL,118076,School,MAGURA,SHALIKHA,BAULIA BHARAT,89.56806,23.35388,18466,1
BUNAGATI SECONDARY GIRLS SCHOOL,118095,School,MAGURA,SHALIKHA,BUNAGATI,89.57719,23.33329,18467,2
AMJAD ALI SECONDARY SCHOOL,118072,School,MAGURA,SHALIKHA,BUNAGATI,89.58213,23.35579,18468,1
PULUM GOLAM SARWAR SECONDARY SCHOOL,118073,School,MAGURA,SHALIKHA,PULUM,89.42081,23.34108,18469,1
PULUM QAZI SALEEMA haq secondary GIRLS SCHOOL,118068,School,MAGURA,SHALIKHA,PULUM,89.42056,23.34194,18470,1
KHATOR RAMANONDOKaTI HIGH SCHOOL,118083,School,MAGURA,SHALIKHA,SABEKKHATOR,89.40028,23.34722,18471,1
BARASHALAI PANCHA PALLI HIGH SCHOOL,117943,School,MAGURA,MAGURA SADAR,JAGLA,89.46389,23.29722,18472,1
CHANDARA PRAGATI SECONDARY SCHOOL,118067,School,MAGURA,SHALIKHA,CHANDRA,89.44611,23.29639,18473,1
GOBRA PANCHAPOLLY HIGH SCHOOL,118093,School,MAGURA,SHALIKHA,GOBRA,89.3257,23.33538,18474,1
KATALI  HIGH SCHOOL,118080,School,MAGURA,SHALIKHA,KATALI,89.338,23.30954,18475,1
SINGRA TILKHARI ML. HIGH SCHOOL,118079,School,MAGURA,SHALIKHA,SINGRA,89.30463,23.35091,18476,1
THAIPARA HIGH SCHOOL,118091,School,MAGURA,SHALIKHA,THAI PARA,89.31351,23.32686,18477,1
MASHAKHALI DADAL PALLI A GONI SECONDARY SCHOOL,118084,School,MAGURA,SHALIKHA,MASAKHALI,89.33536,23.34422,18478,1
BHUL BARIA HIGH SCHOOL,118089,School,MAGURA,SHALIKHA,BHULBARIA,89.2904,23.38976,18479,1
NAGHOSHA IDEAL GIRLS HIGH SCHOOL,118090,School,MAGURA,SHALIKHA,NAGHOSA,89.29282,23.41062,18480,1
NAGHOSA NABAM POLLI HIGH SCHOOL,118087,School,MAGURA,SHALIKHA,NAGHOSA,89.25773,23.38137,18481,1
SHEOJGATI ADORSHO secondary GIRLS SCHOOL,118099,School,MAGURA,SHALIKHA,SEOJGATI,89.26323,23.41458,18482,1
TALKHARI HIGH SCHOOL,118088,School,MAGURA,SHALIKHA,TALKHARI,89.30666,23.38548,18483,1
SHARUSHOONA SECONDARY SCHOOL,118075,School,MAGURA,SHALIKHA,SARUSONA,89.30956,23.3776,18484,1
SHALIKHA THANA HIGH SCHOOL,118082,School,MAGURA,SHALIKHA,SHALIKHA,89.30844,23.37717,18485,1
SREHATTO HIGH SCHOOL,118096,School,MAGURA,SHALIKHA,SREEHATTA,89.40592,23.29925,18486,1
ARPARA IDEAL HIGH SCHOOL,118071,School,MAGURA,SHALIKHA,ARPARA,89.37726,23.29783,18487,1
AVOYA CHARAN HIGH SCHOOL,118070,School,MAGURA,SHALIKHA,BARAICHARA,89.40695,23.29604,18488,1
MALANDA PANCHABOTI GIRLS HIGH SCHOOL,117949,School,MAGURA,MAGURA SADAR,MALANDA,89.38117,23.35176,18489,1
GANGNALIA HIGH SCHOOL,117911,School,MAGURA,MAGURA SADAR,CHANDAN PRATAP,89.37181,23.37529,18490,1
BADANPUR ADARSHA JUNIOR HIGH SCHOOL,118159,School,MAGURA,SREEPUR,BIL NATHUR,89.41611,23.58056,18492,1
BILSONAI HIGH SCHOOL,118147,School,MAGURA,SREEPUR,KALINAGAR,89.43194,23.54639,18493,1
TIKERBILA SECONDARY SCHOOL,118137,School,MAGURA,SREEPUR,PASCHIM RAJAPUR,89.41433,23.57633,18494,2
AMALSAR SECONDARY SCHOOL,118136,School,MAGURA,SREEPUR,AMALSAR,89.42561,23.60758,18495,2
SARONGODIA A.MOJID JOARDER SECONDARY GIRLS SCHOOL,118154,School,MAGURA,SREEPUR,SARANGDIA,89.39912,23.66626,18496,1
CHOUGACHI HIGH SCHOOL,118135,School,MAGURA,SREEPUR,CHAUGACHHI,89.42958,23.61856,18497,1
LANGOLBANDH HIGH SCHOOL,118131,School,MAGURA,SREEPUR,LANGALBAND,89.41433,23.57633,18498,2
MASHALIA JUNIOR SECONDARY GIRLS SCHOOL,118151,School,MAGURA,SREEPUR,MASALIA,89.40472,23.58208,18499,2
NABAGRAM SECONDARY  SCHOOL,118130,School,MAGURA,SREEPUR,NABAGRAM,89.42561,23.60758,18500,2
DORAN NAGAR HIGH SCHOOL,118143,School,MAGURA,SREEPUR,GHASIARA,89.37998,23.66481,18501,1
SAMMILITA PANCHA GRAM GIRL'S HIGH SCHOOL,118146,School,MAGURA,SREEPUR,GHASIARA,89.37965,23.64524,18502,1
DR. NURUL HOSSAIN SECONDARY SCHOOL,118126,School,MAGURA,SREEPUR,GHASIARA,89.38751,23.64638,18503,1
NAKOL RAICHARAN SECONDARY SCHOOL,118128,School,MAGURA,SREEPUR,NAKOL,89.49067,23.58539,18504,1
RAYNAGOR SUNRISE SECONDARY SCHOOL,118148,School,MAGURA,SREEPUR,ROYNAGAR,89.4995,23.55408,18505,1
SREEPUR M.C.PILOT SECONDARY SCHOOL,118127,School,MAGURA,SREEPUR,SREEPUR,89.50061,23.56061,18506,1
MODHUPUR RADHA CHARAN SECONDARY SCHOOL,118142,School,MAGURA,SREEPUR,SREEPUR HUDA,89.46619,23.56325,18507,1
SREEPUR SECONDARY GIRLS SCHOOL,118144,School,MAGURA,SREEPUR,SREEPUR,89.5005,23.55978,18508,1
AMTOIL HIGH SCHOOL,118132,School,MAGURA,SREEPUR,AMTAIL,89.38978,23.59164,18509,1
SABDALPUR UNION SECONDARY SCHOOL,118158,School,MAGURA,SREEPUR,NAOHATTA,89.52758,23.52981,18510,1
PANCHAPALLY SECONDARY SCHOOL,118145,School,MAGURA,SREEPUR,HOGALDANGA,89.49856,23.55131,18511,1
BARISHAT SECONDARY SCHOOL,118155,School,MAGURA,SREEPUR,BARISAT,89.41011,23.61958,18512,1
SREEKOLE SECONDARY SCHOOL,118129,School,MAGURA,SREEPUR,SREEKOL,89.43447,23.57736,18513,1
HAT DARIAPUR SAMMILANI SECONDARY SCHOOL,118138,School,MAGURA,SREEPUR,SACHILAPUR,89.41869,23.56967,18514,1
SHIBRAMPUR HIGH SCHOOL AND COLLEGE,117926,School and College,MAGURA,MAGURA SADAR,SHIBRAMPUR,89.42964,23.48031,26117,1
KULLIA KUCHIAMORA SYED ATOR ALI HIGHER SECONDARY SCHOOL,118009,School and College,MAGURA,MAGURA SADAR,KULIA,89.4373,23.41997,26118,2
PALLABAHUMUKHI SCHOOL AND COLLEGE,118017,School and College,MAGURA,MOHAMMADPUR,PALLA,89.50761,23.42903,26119,1
NOHATA COLLEGIATE GIRL'S SCHOOL,118066,School and College,MAGURA,MOHAMMADPUR,NAHATA,89.55498,23.32353,26120,1
KAJOLI COLLEGIATE SCHOOL,118139,School and College,MAGURA,SREEPUR,KAJALI,89.45739,23.56317,26121,1
