NARAYANGANJ HIGH SCHOOL AND COLLEGE,112420,School and College,NARAYANGANJ,NARAYANGANJ SADAR,SUMIL PARA (SIDDIRGANJ PART),90.49444,23.70006,26174,1
NARAYANGONJ GIRLS  SCHOOL AND COLLEGE,112426,School and College,NARAYANGANJ,NARAYANGANJ SADAR,AMLA PARA,90.50528,23.62681,26175,1
KANAINAGAR SOBAHANIA SCHOOL AND COLLEGE,112405,School and College,NARAYANGANJ,NARAYANGANJ SADAR,CHAR BAKTABALLI,90.49794,23.66211,26176,1
ARRIBS INTERNATIONAL SCHOOL & COLLEGE,112428,School and College,NARAYANGANJ,NARAYANGANJ SADAR,MASDAIR (PART-A),90.49039,23.62586,26177,1
KAMAR ALI HIGH SCHOOL AND COLLEGE,112415,School and College,NARAYANGANJ,NARAYANGANJ SADAR,FATULLA,90.49328,23.63,26178,1
RUPSHI NEW MODEL  SCHOOL AND COLLEGE,112510,School and College,NARAYANGANJ,RUPGANJ,GANDHARBAPUR (PART),90.46158,23.67028,26179,1
HAJI MOHAMMAD EKHLAS UDDIN BHU.H/S AND COLLEGE,112511,School and College,NARAYANGANJ,RUPGANJ,DEBAI,90.52164,23.74628,26180,1
BHULTA UCHHA MADHAMIC BIDDALAYA,112492,School and College,NARAYANGANJ,RUPGANJ,BULTA,90.51706,23.72253,26181,1
NURUNNESSA UCHCHA MADHYAMIK BIDYALAYA,112537,School and College,NARAYANGANJ,RUPGANJ,DAUDPUR,90.54011,23.84158,26182,1
SONARGAON G.R.INSTITUTION,112373,School and College,NARAYANGANJ,SONARGAON,AMINPUR,90.53539,23.80836,26183,1
BARADI M.L.  SCHOOL AND COLLEGE,112337,School and College,NARAYANGANJ,SONARGAON,BARADI,90.59828,23.63819,26184,1
MaGHNA SHILPA NAGARI high SCHOOL AND COLLEGE,112335,School and College,NARAYANGANJ,SONARGAON,PIRIJPUR,90.58808,23.63464,26185,1
