inst name, eiin, inst_type, district, thana, mauza, long, lat, serial,isUnique
GOVT. TOLARAM COLLEGE,112478,College,NARAYANGANJ,NARAYANGANJ SADAR,ALLAMA IQBAL RD(TULARAM COLL),90.497307,23.622938,1416,1
MURAPARA COLLEGE,112535,College,NARAYANGANJ,RUPGANJ,BRAHMANGAON,90.520905,23.780937,1417,1
GOVT. SAFAR ALI COLLEGE,112327,College,NARAYANGANJ,ARAIHAZAR,ARAIHAZAR,90.21288,25.0093,1418,1
ROKANUDDIN MOLLA GIRLS COLLEGE,112326,College,NARAYANGANJ,ARAIHAZAR,CHHOTA BARAI PARA,90.22736,25.02078,1419,1
HAZI BELAYET HOSSAIN COLLEGE,112328,College,NARAYANGANJ,ARAIHAZAR,UCHITPUR,90.63792,23.74939,1420,1
PANCHRUKHI BEGUM ANOWARA COLLEGE,112329,College,NARAYANGANJ,ARAIHAZAR,PANCHRUKHI,90.71178,23.80319,1421,1
KADAM RASUL DEGREE COLLEGE,112401,College,NARAYANGANJ,BANDAR,BANDAR,90.52011,23.62592,1422,1
NAZIMUDDIN BHUIYAN DEGREE COLLEGE,112400,College,NARAYANGANJ,BANDAR,MADANPUR,90.54278,23.58361,1423,1
NARAYANGaNJ GOVT. MOHILA COLLEGE,112479,College,NARAYANGANJ,NARAYANGANJ SADAR,COLLEGE ROAD,90.50072,23.61914,1424,1
NARAYANGONJ COLLEGE,112480,College,NARAYANGANJ,NARAYANGANJ SADAR,DIG BARUR BAZAR,90.4905,23.69344,1425,1
GOVT ADAMJEE NAGAR M W COLLEGE,112477,College,NARAYANGANJ,NARAYANGANJ SADAR,KADAMTALI DAKSHIN,90.51856,23.67392,1426,1
NARAYANGONJ MODEL COLLEGE,131870,College,NARAYANGANJ,NARAYANGANJ SADAR,KHOAR PATTY,90.47708,23.63992,1427,1
HAJI MISIR ALI university COLLEGE,112482,College,NARAYANGANJ,NARAYANGANJ SADAR,DEUL PARA(PART),90.46772,23.67703,1428,1
ABDUL AZIZ MIA AYESHA KHATUN COLLEGE,112536,College,NARAYANGANJ,RUPGANJ,KENDUA KHALPAR,90.48906,23.69217,1429,1
SALIM UDDIN CHOWDHURY COLLEGE,112534,College,NARAYANGANJ,RUPGANJ,KENDUA PARA,90.51722,23.74625,1430,1
SONARGAON KAZI FAZLUL HAQUE WOMENS COLLEGE,112370,College,NARAYANGANJ,SONARGAON,BARI MAJLISH,90.52025,23.78981,1431,1
SONARGAON DEGREE COLLEGE,112369,College,NARAYANGANJ,SONARGAON,SHOLA PARA,90.52517,23.70339,1432,1
HOSSAIN PUR S.P.UNION COLLEGE,112371,College,NARAYANGANJ,SONARGAON,HOSSAINPUR,90.57347,23.62222,1433,1
MAJHINAH MOUJAR AMMADIA ISLAMIA FAZIL MADRASHA,112519,Madrasha,NARAYANGANJ,RUPGANJ,MAJHINA,90.1299,23.88148,7483,1
AL-ARAFA ISLAMIA DAKHIL MADRASHA,112533,Madrasha,NARAYANGANJ,RUPGANJ,PUBGAON,90.13103,23.87821,7484,1
ARAIHAZAR EMDADUL ULUM ALIM MADRASAH,112324,Madrasha,NARAYANGANJ,ARAIHAZAR,ARAIHAZAR,90.23467,24.95043,7485,1
RAOJATUL MUTTA QEEN DAKIL MADRASHA,131643,Madrasha,NARAYANGANJ,ARAIHAZAR,BISHNANDI,90.66094,23.79408,7486,1
BALLAVDI KANDA DAKHIL MADRASAH,112325,Madrasha,NARAYANGANJ,ARAIHAZAR,BALLABHDI,90.60581,23.79519,7487,1
PURBAKANDI ADARSAH DAKHIL MADRASAH,112321,Madrasha,NARAYANGANJ,ARAIHAZAR,JHUKANDI,90.67108,23.76294,7488,1
GOPLADI FAZIL MADRASAH,112319,Madrasha,NARAYANGANJ,ARAIHAZAR,GOPALDI,90.67572,23.72058,7489,1
RASULPUR MOHILA DAKHIL MADRASHA,112318,Madrasha,NARAYANGANJ,ARAIHAZAR,SATGRAM,90.71233,23.80106,7490,1
RASULPUR OSMAN MOLLAH ISLAMIA FAZIL MADRASA,112322,Madrasha,NARAYANGANJ,ARAIHAZAR,BARA NAOGAON,90.69675,23.816,7491,1
ADURIA ISLAMIA DAKHIL MADRASHA,112517,Madrasha,NARAYANGANJ,RUPGANJ,ADHURIA,90.64614,23.85194,7492,1
BANDAR ISLAMIA FAZIL MADRASA,112395,Madrasha,NARAYANGANJ,BANDAR,BIBIJHORA,90.60758,23.82825,7493,1
NABIGONJ ISLAMIA SINIOR ALIM MADRASHA,112396,Madrasha,NARAYANGANJ,BANDAR,NABIGANJ ROAD,90.59931,23.80247,7494,1
JAMEA ISLAMIA ALIM  MADRASHA,112393,Madrasha,NARAYANGANJ,BANDAR,CHAPATALI (PART),90.52344,23.63125,7495,1
NURUN ALANUR ASHAKI HOSSAINIA DAKHIL MADRASHA,112399,Madrasha,NARAYANGANJ,BANDAR,JANGAL,90.53219,23.62778,7496,1
BISWANOBI (S) ISLAMIA ALIM MADRASHA,112394,Madrasha,NARAYANGANJ,BANDAR,MADANGANJ (PART),90.53142,23.60242,7497,1
MDANPUR RIAZUL ULUM ALIM MADRASAH,112397,Madrasha,NARAYANGANJ,BANDAR,MADANPUR,90.52597,23.60828,7498,1
MUSAPUR DARUSSUNNATH ISLAMIA DAKHIL MADRASAH,112398,Madrasha,NARAYANGANJ,BANDAR,MUSAPUR,90.52083,23.59294,7499,1
ADARSHA  MOHILA MADRASHA,112468,Madrasha,NARAYANGANJ,NARAYANGANJ SADAR,GOLACHIPA,90.51069,23.61231,7500,1
SHIMRAIL D.S,N.S ALIM MADRASHA,112460,Madrasha,NARAYANGANJ,NARAYANGANJ SADAR,SIMRAIL,90.51558,23.69944,7501,1
MIZMIZI PAINADI FAZIL MADRASHA,112455,Madrasha,NARAYANGANJ,NARAYANGANJ SADAR,MIJMIZI BATEN PARA,90.50094,23.69858,7502,1
MIZMIZI HAZI ABDUSSAMAD ISLAMIA ALIM MADRASHA,112458,Madrasha,NARAYANGANJ,NARAYANGANJ SADAR,MIJMIZI PASCHIM PARA,90.50572,23.69028,7503,1
SIDDHIRGONJ D.S.ISLAMI ALIM MADRASAH,112459,Madrasha,NARAYANGANJ,NARAYANGANJ SADAR,SIDDIRGANJ KALABAGH PURBA,90.49986,23.68586,7504,1
GODNAIL BAGPARA ALIM MADRASHA,112465,Madrasha,NARAYANGANJ,NARAYANGANJ SADAR,GODNAIL BAGH PARA,90.51631,23.65481,7505,1
JALKURI ISLAMIA DAKHIL MADRASHA,112463,Madrasha,NARAYANGANJ,NARAYANGANJ SADAR,JALKURI (MAJ PARA),90.51525,23.66447,7506,1
FEROJA KHATUN MOHILA DAKHIL MADRASHA,112473,Madrasha,NARAYANGANJ,NARAYANGANJ SADAR,ALIR TEK,90.49622,23.66494,7507,1
MOHAMMADIA MOHILA DAKHIL MADRASHA,112475,Madrasha,NARAYANGANJ,NARAYANGANJ SADAR,GODNAIL MANDAL PARA,90.46544,23.59394,7508,1
BAKTABALI ISLAMIA SENIOR MADRASHA,112470,Madrasha,NARAYANGANJ,NARAYANGANJ SADAR,CHAR BAKTABALLI,90.46675,23.58567,7509,1
DHARMAGANJ ISLAMIA ARABIA DAKHIL MADRASAH,112462,Madrasha,NARAYANGANJ,NARAYANGANJ SADAR,SIMRAIL,90.48389,23.62867,7510,1
MUSLIM NAGAR ISLAMIA  DAKHIL MADRASHA,112464,Madrasha,NARAYANGANJ,NARAYANGANJ SADAR,SREEDHARDI (MUSLIMNAGAR),90.49278,23.62517,7511,1
NARAYANGONJ ISLAMIA FAZIL MADRASHA,112467,Madrasha,NARAYANGANJ,NARAYANGANJ SADAR,MASDAIR (PART-A),90.47197,23.62069,7512,1
SAYEDPUR HAZI ALI HOSSAIN BAPARI ALIM MADRASA,112456,Madrasha,NARAYANGANJ,NARAYANGANJ SADAR,SAYEDPUR,90.49186,23.64181,7513,1
DARUSSUNNAH KAMIL MADRASHA,112469,Madrasha,NARAYANGANJ,NARAYANGANJ SADAR,KASHIPUR,90.49261,23.59561,7514,1
BHUIGHAR DARUSSUNNAH ISLAMIA SENIOR MADRASAH,112472,Madrasha,NARAYANGANJ,NARAYANGANJ SADAR,BHUIGAR,90.48358,23.64614,7515,1
DELPARA ISLAMIA FAZIL MADRASHA,112461,Madrasha,NARAYANGANJ,NARAYANGANJ SADAR,DEUL PARA(PART),90.48525,23.64575,7516,1
ROWJATUS SALEHIN ALIM MADRASA,112474,Madrasha,NARAYANGANJ,NARAYANGANJ SADAR,SIACHAR,90.48331,23.64886,7517,1
SHAHI MAHALLA MOHAMMADIA ALIM MADRASHA,112457,Madrasha,NARAYANGANJ,NARAYANGANJ SADAR,DEUL PARA(PART),90.48258,23.65444,7518,1
TARAIL ISLAMIA DAKHIL MADRASAH,112518,Madrasha,NARAYANGANJ,RUPGANJ,BIRABA,90.50164,23.61314,7519,1
KALADI SHAHAJ UDDIN  JAMEA-E-ISLAMIA FAZIL MADRASA,112528,Madrasha,NARAYANGANJ,RUPGANJ,KALADI,90.56075,23.86625,7520,1
RANIPURA MADRASATUL QURAN WASS SUNNA ALIM MADRASAH,131639,Madrasha,NARAYANGANJ,RUPGANJ,RANI PURA,90.55175,23.84819,7521,1
HAZI ABU TAHER BHUIYAN GIRLS MADRASAH,112516,Madrasha,NARAYANGANJ,RUPGANJ,RANI PURA,90.55425,23.83269,7522,1
RUPSI ISLAMIA DAKHIL MADRASA,112526,Madrasha,NARAYANGANJ,RUPGANJ,CHOWDHURY PARA,90.56131,23.82675,7523,1
MUGARKUL MOHAMMADIA DAKHIL MADRASAH,112527,Madrasha,NARAYANGANJ,RUPGANJ,GANDHARBAPUR (PART),90.57042,23.84147,7524,1
NOAPARA ISLAMIA MOHILA ALIM MADRASHA,112530,Madrasha,NARAYANGANJ,RUPGANJ,BASUNDA,90.51903,23.75664,7525,1
CHARITALUK DARUL HUDA  ALIM MADRASHA,112521,Madrasha,NARAYANGANJ,RUPGANJ,BHOLABA,90.52767,23.72406,7526,1
MARTUZABAD  DARUL ULUM FAZIL MADRASHA,112523,Madrasha,NARAYANGANJ,RUPGANJ,BHAELA,90.581,23.87475,7527,1
PACHAIKHA DARUS SALAM MOHILA DAKHIL MADRASHA,112532,Madrasha,NARAYANGANJ,RUPGANJ,PANCHAIKHAN,90.58631,23.87353,7528,1
BELDI DARUL HADIS ALIA MADRASA,112520,Madrasha,NARAYANGANJ,RUPGANJ,BELDI,90.55839,23.79025,7529,1
DEBOI KAZIR BAG ALIM MADRASAH,112522,Madrasha,NARAYANGANJ,RUPGANJ,DEBAGRAM,90.54467,23.86883,7530,1
ZINDA SHAH YASIN MOHILA DAKHIL MADRASAH,112531,Madrasha,NARAYANGANJ,RUPGANJ,TIRMARA,90.52375,23.85669,7531,1
PATALGONJ PASCHIMPARA MOSTAFA E SONNIA DAKHIL MADRASAH,112515,Madrasha,NARAYANGANJ,RUPGANJ,PITALGANJ,90.52267,23.83008,7532,1
BARADI NESA  ISLAMIA ALIM MADRASA,112367,Madrasha,NARAYANGANJ,SONARGAON,BARADI,90.62453,23.65861,7533,1
KAL TAPARA SENIOR FAZIL MADRASHA,112366,Madrasha,NARAYANGANJ,SONARGAON,KALTA PARA,90.63619,23.69981,7534,1
SAYDA  KHATUN  ISLAMIA  DAKHIL    MADRASHA,112362,Madrasha,NARAYANGANJ,SONARGAON,KANCHPUR,90.60647,23.73292,7535,1
TAHER PUR ISLAMIA ALIM MADRASHA,112365,Madrasha,NARAYANGANJ,SONARGAON,MANGALERGAON,90.57853,23.65467,7536,1
BHARGAON  NESERAIA  DAKHIL MADRADA,112360,Madrasha,NARAYANGANJ,SONARGAON,BHARGAON,90.61383,23.61425,7537,1
MOHMMADPUR DAKHIL MADRASAH,112320,Madrasha,NARAYANGANJ,SONARGAON,BHARGAON,90.58175,23.61897,7538,1
NANAKHI D.H. ALIM MADRSHA,112363,Madrasha,NARAYANGANJ,SONARGAON,NANAKHI,90.55561,23.73433,7539,1
SHADIPUR ISLAMIA SENIOR ALIM MADRASHA,112364,Madrasha,NARAYANGANJ,SONARGAON,BARAGAON,90.58433,23.70072,7540,1
FORDI  ISLAMIA  DAKHIL MADRASA,112361,Madrasha,NARAYANGANJ,SONARGAON,FARDI,90.57797,23.72778,7541,1
DAULAPUR  ISLAMIA  DAKHIL MADRASA,112368,Madrasha,NARAYANGANJ,SONARGAON,DAULATPUR THOTALIA,90.55225,23.58425,7542,1
ARAIHAZAR PILOT HIGH SCHOOL,112299,School,NARAYANGANJ,ARAIHAZAR,ARAIHAZAR,90.19233,24.94996,19955,1
ROKaNUDDIN  PILOT GIRLS HIGH SCHOOL,112312,School,NARAYANGANJ,ARAIHAZAR,CHHOTA BARAI PARA,90.18774,24.99895,19956,1
CHAITANKANDA GOLAM MOHAMMAD HIGH SCHOOL,112313,School,NARAYANGANJ,ARAIHAZAR,CHAITANKANDI,90.66267,23.79153,19957,1
A M BADRUZZAMAN HIGH SCHOOL,130544,School,NARAYANGANJ,ARAIHAZAR,LENGARDI,90.65589,23.79269,19958,1
UZAN GOBINDO BINIER CHAR HIGH SCHOOL,112302,School,NARAYANGANJ,ARAIHAZAR,BINAIR CHAR,90.66028,23.78703,19959,1
BANTI IDEAL HIGH SCHOOL,112297,School,NARAYANGANJ,ARAIHAZAR,BANTI,90.71486,23.75781,19960,1
CENTRAL CORONATION HIGH SCHOOL,112303,School,NARAYANGANJ,ARAIHAZAR,DUPTARA,90.70936,23.78806,19961,1
PANCHGAON ML HIGH SCHOOL,112306,School,NARAYANGANJ,ARAIHAZAR,PANCHGAON,90.61939,23.75983,19962,1
KALAGACHIA HIGH SCHOOL,112310,School,NARAYANGANJ,ARAIHAZAR,KALAGACHHIA,90.60186,23.7695,19963,1
SHINGHADI M.A MOTALEB BHUIYAN HIGH SCHOOL,112317,School,NARAYANGANJ,ARAIHAZAR,CHHOTA SALMADI,90.5955,23.81303,19964,1
KALAPAHARIA UNION HIGH SCHOOL,112308,School,NARAYANGANJ,ARAIHAZAR,NIJ KALA PAHARIA,90.64053,23.80911,19965,1
SHAMBHUPUAR HIGH SCHOOL,112348,School,NARAYANGANJ,ARAIHAZAR,SHOBHARAMPUR,90.64244,23.76328,19966,1
KABI NAZRUL  SCHOOL and college,112311,School,NARAYANGANJ,ARAIHAZAR,NAYANABAD,90.64936,23.74786,19967,1
GOPALDI GIRLS HIGH SCHOOL,112300,School,NARAYANGANJ,ARAIHAZAR,GOPALDI,90.71781,23.69475,19968,1
SADASADI M.L.HIGH SCHOOL,112304,School,NARAYANGANJ,ARAIHAZAR,GOPALDI,90.71361,23.71642,19969,1
KALAGACHIA  R.F. HIGH SCHOOL,112301,School,NARAYANGANJ,ARAIHAZAR,UTTAR KALAGACHHIA,90.69164,23.75022,19970,1
PURINDA K M SADEKUR RAHMAN HIGH SCHOOL,112309,School,NARAYANGANJ,ARAIHAZAR,BARA NAOGAON,90.68869,23.75778,19971,1
PANCHRUKHI HAZI SHAHEB ALI FAKIR HIGH SCHOOL,112314,School,NARAYANGANJ,ARAIHAZAR,PANCHRUKHI,90.71136,23.80231,19972,1
ATADI  HIGH SCHOOL,112316,School,NARAYANGANJ,ARAIHAZAR,ATADI,90.63,23.84644,19973,1
JANGALIA HIGH SCHOOL,112315,School,NARAYANGANJ,ARAIHAZAR,JANGALIA,90.60875,23.82931,19974,1
HAZI SERAJ UDDIN MEMORIAL HIGH SCHOOL,112385,School,NARAYANGANJ,BANDAR,WILLSON ROAD (UTTAR),90.67758,23.73869,19976,1
HAJEE ABDUL MALEK HIGH SCHOOL,112387,School,NARAYANGANJ,BANDAR,KUSIARA,90.51256,23.60531,19977,1
MIRKUNDI HIGH SCHOOL,112391,School,NARAYANGANJ,BANDAR,MIRKUNDI,90.51789,23.61258,19978,1
NABIGANJ GIRLS HIGH SCHOOL,112376,School,NARAYANGANJ,BANDAR,WILLSON ROAD (UTTAR),90.51275,23.61342,19979,1
ALHAJ KHORSHEDUNNESA HIGH SCHOOL,112375,School,NARAYANGANJ,BANDAR,JIUDHARA,90.55033,23.61742,19980,1
KALAGACHIYA UNION GIRLS HIGH SCHOOL,112392,School,NARAYANGANJ,BANDAR,ALISARDI,90.52228,23.62992,19981,1
PEAR SATTER LATIF HIGH SCHOOL,112390,School,NARAYANGANJ,BANDAR,KALYANDI,90.51814,23.62414,19982,1
KALAGACHIA UNION HIGH SCHOOL,112382,School,NARAYANGANJ,BANDAR,NISANG,90.5455,23.67981,19983,1
SONAKANDA HIGH SCHOOL,112388,School,NARAYANGANJ,BANDAR,MADANGANJ (PART),90.56786,23.66981,19984,1
MALIBAG KARAMATIA HIGH SCHOOL,112381,School,NARAYANGANJ,BANDAR,LANGALBANDA,90.51431,23.60386,19985,1
SHAMSUZZOHA M.B.UNION HIGH SCHOOL,112386,School,NARAYANGANJ,BANDAR,BHAJANDI (TRIBENI),90.52522,23.58669,19986,1
SIKDER ABDUL MALEK HIGH SCHOOL,112374,School,NARAYANGANJ,BANDAR,BANDAR,90.54675,23.69675,19987,1
LUXMINARAYAN COTTON MILLS HIGH SCHOOL,112431,School,NARAYANGANJ,NARAYANGANJ SADAR,RASULBAGH,90.55094,23.69972,19988,1
KURI PARA HIGH SCHOOL,112384,School,NARAYANGANJ,BANDAR,KURIPARA (PART),90.51794,23.61264,19989,1
ADAMJEE ACTIVE SCHOOL,131323,School,NARAYANGANJ,NARAYANGANJ SADAR,SUMIL PARA (SIDDIRGANJ PART),90.51606,23.61253,19990,1
LAKHHAN KHOLA  AL haj Fazlur  rahman HIGH SCHOOL,112389,School,NARAYANGANJ,BANDAR,DAKSHIN LAKHANKHOLA,90.51822,23.70672,19991,1
DREDGER JUNIOR HIGH SCHOOL,112443,School,NARAYANGANJ,NARAYANGANJ SADAR,ISHAKHAN ROAD,90.52328,23.66103,19992,1
NARAYANGONJ BAR ACADEMY,112422,School,NARAYANGANJ,NARAYANGANJ SADAR,KHANPUR (PART),90.53367,23.67581,19993,1
BIBI MARIOM GIRLS HIGH SCHOOL,112421,School,NARAYANGANJ,NARAYANGANJ SADAR,ISHAKHAN ROAD,90.52097,23.67517,19994,1
SHANARPAR SHEKH MORTAZA ALI HIGH SCHOOL,112404,School,NARAYANGANJ,NARAYANGANJ SADAR,SANARPAR,90.52378,23.65108,19995,1
NARAYANGANJ PREPARATORY SCHOOL,133700,School,NARAYANGANJ,NARAYANGANJ SADAR,K.B. SHAH ROAD,90.51114,23.64275,19996,1
NARAYANGANJ IDEAL SCHOOL,131476,School,NARAYANGANJ,NARAYANGANJ SADAR,K.B. SHAH ROAD,90.49811,23.62336,19997,1
GANABIDYA NIKETAN,112424,School,NARAYANGANJ,NARAYANGANJ SADAR,NAYAMATI,90.50083,23.62272,19998,1
MORGAN GIRLS HIGH SCHOOL,112419,School,NARAYANGANJ,NARAYANGANJ SADAR,DEOBHOGH (PART),90.50392,23.61858,19999,1
DEOBHOG HAZI UZIR ALI HIGH SCHOOL,112429,School,NARAYANGANJ,NARAYANGANJ SADAR,BARA DEOBHOG (PART),90.50311,23.62083,20000,1
JOY GOVINDA HIGH SCHOOL,112417,School,NARAYANGANJ,NARAYANGANJ SADAR,PAIK PARA (NAMA PARA),90.503,23.62358,20001,1
WATER DEVELOPMENT BOARD JUNIOR SCHOOL,112358,School,NARAYANGANJ,NARAYANGANJ SADAR,ATI,90.50308,23.61153,20002,1
FULKOLY LABORATORY HIGH SCHOOL,131357,School,NARAYANGANJ,NARAYANGANJ SADAR,ATI PART,90.50142,23.61467,20003,1
AL-HERA INTERNATIONAL HIGH SCHOOL,131343,School,NARAYANGANJ,NARAYANGANJ SADAR,PAINADI PURBA PART,90.48708,23.61003,20004,1
GIASUDDIN ISLAMIC MODEL SCHOOL,131337,School,NARAYANGANJ,NARAYANGANJ SADAR,ATI PART,90.49975,23.60647,20005,1
ALI AKBAR MODEL HIGH SCHOOL,131392,School,NARAYANGANJ,NARAYANGANJ SADAR,SIMRAIL PART,90.49264,23.68925,20006,1
BARNAMALA KINDERGARTEN AND HIGH SCHOOL,131344,School,NARAYANGANJ,NARAYANGANJ SADAR,SIDDIRGANJ KALABAGH PASCHIM,90.50867,23.69561,20007,1
HAZI SHAMSUDDIN HIGH SCHOOL,131333,School,NARAYANGANJ,NARAYANGANJ SADAR,PAINADI PURBA PART,90.50717,23.69372,20008,1
M.W. HIGH SCHOOL,112436,School,NARAYANGANJ,NARAYANGANJ SADAR,KADAMTALI DAKSHIN,90.50489,23.70108,20009,1
MORNING SUN SCHOOL AND COLLEGE,131314,School,NARAYANGANJ,NARAYANGANJ SADAR,SANARPAR,90.51117,23.70339,20010,1
MIZMIZI PAINADI REKMAT ALI HIGH SCHOOL,112409,School,NARAYANGANJ,NARAYANGANJ SADAR,PAINADI PURBA PART,90.50447,23.69536,20011,1
MIZMIZI PASCHIMPARA HIGH SCHOOL,112412,School,NARAYANGANJ,NARAYANGANJ SADAR,MIJMIZI PASCHIM PARA,90.51575,23.67553,20012,1
SAFAR ALI BHUIYAN HIGH SCHOOL,131331,School,NARAYANGANJ,NARAYANGANJ SADAR,SUMIL PARA (SIDDIRGANJ PART),90.50506,23.69408,20013,1
POWER DEVELOPMENT BOARD SECONDARY SCHOOL,SHIDHIRGONG,112410,School,NARAYANGANJ,NARAYANGANJ SADAR,POWER STATION & SAILO,90.51725,23.67469,20014,1
GODENAIL HIGH SCHOOL,112432,School,NARAYANGANJ,NARAYANGANJ SADAR,ARAMBAGH (JUTE MARKET)(GODNAIL,90.51744,23.68336,20015,1
SAFURA KHATUN PILOT GIRLS HIGH SCHOOL,112439,School,NARAYANGANJ,NARAYANGANJ SADAR,GODNAIL MANDAL PARA,90.50869,23.68644,20016,1
CHITTARANJAN COTTON MILLS HIGH SCHOOL,112414,School,NARAYANGANJ,NARAYANGANJ SADAR,ARAMBAGH (JUTE MARKET)(GODNAIL,90.49558,23.68558,20017,1
SUNRISE MODEL SCHOL,131326,School,NARAYANGANJ,NARAYANGANJ SADAR,GODNAIL BAGH PARA,90.52194,23.68581,20018,1
ADAMJEE UMM-AL QURA JUNIOR HIGH SCHOOL,131453,School,NARAYANGANJ,NARAYANGANJ SADAR,SUMIL PARA (SIDDIRGANJ PART),90.51633,23.67436,20019,1
SHAHEED TITUMIR ACADEMY NARAYANGANJ,131384,School,NARAYANGANJ,NARAYANGANJ SADAR,KAYEMPUR,90.51519,23.66525,20020,1
DHANKUNDA POPULAR HIGH SCHOOL,112442,School,NARAYANGANJ,NARAYANGANJ SADAR,DHANKUNDA,90.51642,23.64947,20021,1
PURBA JALKURI ADARSHA HIGH SCHOOL,112444,School,NARAYANGANJ,NARAYANGANJ SADAR,JALKURI (MAJ PARA),90.51711,23.66728,20022,1
JALKURI HIGH SCHOOL,112411,School,NARAYANGANJ,NARAYANGANJ SADAR,JALKURI (PASCHIM PARA),90.52486,23.67306,20023,1
KURARPAR ADORSO HIGH SCHOOL,112453,School,NARAYANGANJ,NARAYANGANJ SADAR,GOPCHAR,90.5085,23.63967,20024,1
MUKTERKANDI ADARSHA HIGH SCHOOL,112446,School,NARAYANGANJ,NARAYANGANJ SADAR,GOPCHAR,90.51183,23.6595,20025,1
NAZMUN NESA GIRLS HIGH SCHOOL,112430,School,NARAYANGANJ,NARAYANGANJ SADAR,CHAR BAKTABALLI,90.49089,23.66228,20026,1
PURBA CHAR GARKUL HIGH SCHOOL,112447,School,NARAYANGANJ,NARAYANGANJ SADAR,CHAR GANGAPRASAD(S.NAGAR),90.47442,23.58183,20027,1
BEGUM ROKEYA KHANDAKAR PAURA HIGH SCHOOL,112427,School,NARAYANGANJ,NARAYANGANJ SADAR,MASDAIR (PART-A),90.45161,23.60078,20028,1
HARIHARPARA HIGH SCHOOL,112438,School,NARAYANGANJ,NARAYANGANJ SADAR,HARIHAR PARA,90.45175,23.59236,20029,1
NARAYANGONJ GOVT. GIRL'S HIGH SCHOOL,112425,School,NARAYANGANJ,NARAYANGANJ SADAR,MASDAIR,90.45925,23.56508,20030,1
ZILLA POLICE LINE SCHOOL NARAYANGONJ,131360,School,NARAYANGANJ,NARAYANGANJ SADAR,FATULLA,90.46175,23.59489,20031,1
ADARSHA SCHOOL NARANGANJ,112423,School,NARAYANGANJ,NARAYANGANJ SADAR,MASDAIR (PART-A),90.45192,23.59992,20032,1
MUSLIMNAGaR HAZI ABUL KADER KAZI ABDUL MOJIT JU SCHOOL,112451,School,NARAYANGANJ,NARAYANGANJ SADAR,SREEDHARDI (MUSLIMNAGAR),90.49222,23.62194,20033,1
NABINAGAR SHAHWAR ALI HIGH SCHOOL,112450,School,NARAYANGANJ,NARAYANGANJ SADAR,DHARMAGANJ,90.47131,23.632,20034,1
FATULLA PILOT HIGH SCHOOL,112407,School,NARAYANGANJ,NARAYANGANJ SADAR,DAPA IDRAKPUR (DAPA),90.46314,23.61986,20035,1
MUKTI JODDHA SMRITY BIDYANIKETON,112452,School,NARAYANGANJ,NARAYANGANJ SADAR,HAZI GONJ(PART),90.49167,23.62592,20036,1
ISDAIR RABEYA HOSSAIN HIGH SCHOOL,112413,School,NARAYANGANJ,NARAYANGANJ SADAR,ISDAIR (PART),90.46686,23.63089,20037,1
KANON PRE-CADET AND HIGH SCHOOL,131394,School,NARAYANGANJ,NARAYANGANJ SADAR,LALPUR,90.49339,23.62475,20038,1
I.E.T. GOVT. HIGH SCHOOL,112416,School,NARAYANGANJ,NARAYANGANJ SADAR,NEW HAZIGONJ,90.47522,23.64717,20039,1
HARBAD ACADEMY,131412,School,NARAYANGANJ,NARAYANGANJ SADAR,FATULLA,90.50772,23.63964,20040,1
IDEAL KINDERGARTEN AND HIGH SCHOOL,133698,School,NARAYANGANJ,NARAYANGANJ SADAR,FATULLA,90.50153,23.63839,20041,1
TAZEK PRODHAN  KINDERGARTEN AND HIGH SCHOOL,131426,School,NARAYANGANJ,NARAYANGANJ SADAR,MASINABANDA,90.51142,23.63472,20042,1
SYEDPUR BANGA BANDHU HIGH SCHOOL,112418,School,NARAYANGANJ,NARAYANGANJ SADAR,SAYEDPUR,90.49478,23.64244,20043,1
HAT KHOLA  high school,112454,School,NARAYANGANJ,NARAYANGANJ SADAR,KASHIPUR,90.48733,23.633,20044,1
KASHIPUR ADARSHA GIRLS HIGH SCHOOL,112445,School,NARAYANGANJ,NARAYANGANJ SADAR,KASHIPUR,90.497,23.63028,20045,1
AHSAN UDDIN HIGH SCHOOL,112449,School,NARAYANGANJ,NARAYANGANJ SADAR,DEUL PARA(PART),90.50164,23.59108,20046,1
HAZEE PANDEY ALI HIGH SCHOOL,112406,School,NARAYANGANJ,NARAYANGANJ SADAR,BHUIGAR,90.49886,23.59003,20047,1
DELPARA HIGH SCHOOL,112435,School,NARAYANGANJ,NARAYANGANJ SADAR,DEUL PARA(PART),90.48978,23.60128,20048,1
MOHAMMAD RAMJAN ALI CHISHTI HIGH SCHOOL,112336,School,NARAYANGANJ,NARAYANGANJ SADAR,BHUIGAR,90.48364,23.60569,20049,1
KAMRUN NAHAR SCHOOL AND COLLEGE,133704,School,NARAYANGANJ,NARAYANGANJ SADAR,BHUIGAR,90.489,23.60697,20050,1
PAGLA HIGH SCHOOL,112440,School,NARAYANGANJ,NARAYANGANJ SADAR,DHOPATITA,90.46436,23.67853,20051,1
SHIACHAR ADARSHA SCHOOL,131393,School,NARAYANGANJ,NARAYANGANJ SADAR,DAPA IDRAKPUR (DAPA),90.48436,23.67903,20052,1
ALHAJ ABDUL AWAUL (CH)HIGH SCHOOL,131370,School,NARAYANGANJ,NARAYANGANJ SADAR,SIACHAR,90.4755,23.66736,20053,1
ADARSHA ACADEMY,131405,School,NARAYANGANJ,NARAYANGANJ SADAR,KUTUBPUR,90.47694,23.68903,20054,1
PARAMOUNT INTERNATIONAL SCHOOL AND COLLEGE,131397,School,NARAYANGANJ,NARAYANGANJ SADAR,SIACHAR,90.47739,23.68897,20055,1
WAYS KORANI ADARSHA HIGH SCHOOL,131365,School,NARAYANGANJ,NARAYANGANJ SADAR,DEUL PARA(PART),90.46133,23.66567,20056,1
ANANDALOK HIGH SCHOOL,112408,School,NARAYANGANJ,NARAYANGANJ SADAR,SANARPAR,90.48128,23.66978,20057,1
DAPA ADARSHA HIGH SCHOOL,112441,School,NARAYANGANJ,NARAYANGANJ SADAR,DAPA IDRAKPUR (DAPA),90.49019,23.65128,20058,1
MOHAR ALI SHAH NUR BANU HIGH SCHOOL,112496,School,NARAYANGANJ,RUPGANJ,TARAIL,90.47392,23.66689,20059,1
NAWAB ASKARY ADARSHA HIGH SCHOOL,112504,School,NARAYANGANJ,RUPGANJ,NABAB ASKARI JUTE MILL,90.47458,23.65378,20060,1
HAJI RAFIZUDDIN BHUIYAN GIRLS HIGH SCHOOL,112501,School,NARAYANGANJ,RUPGANJ,KANCHAN (PART),90.56169,23.86531,20061,1
SATTAR JUTE MILLS MODEL HIGH SCHOOL,112506,School,NARAYANGANJ,RUPGANJ,TRISKAHUNI,90.56658,23.86517,20062,1
ASHRAF JUTE MILLS ADARSHA HIGH SCHOOL,112502,School,NARAYANGANJ,RUPGANJ,KRISHNANAGAR,90.55425,23.83703,20063,1
GANDHARBAPUR HIGH SCHOOL,112495,School,NARAYANGANJ,RUPGANJ,GANDHARBAPUR (PART),90.55561,23.81947,20064,1
HAZI AYET ALI BHUIYAN HIGH SCHOOL,112494,School,NARAYANGANJ,RUPGANJ,GANDHARBAPUR (PART),90.57197,23.84139,20065,1
HAJI NUR UDDIN AHAMMED HIGH SCHOOL,112509,School,NARAYANGANJ,RUPGANJ,GANDHARBAPUR (PART),90.55147,23.83422,20066,1
BHOLABO SHAHID HIGH SCHOOL,112497,School,NARAYANGANJ,RUPGANJ,BHOLABA,90.52733,23.73742,20067,1
GANABANGLA  HIGH  SCHOOL,112498,School,NARAYANGANJ,RUPGANJ,KURAIL,90.54036,23.74703,20068,1
ADARSHA HIGH SCHOOL(MITHABO),112500,School,NARAYANGANJ,RUPGANJ,MITHABA,90.58811,23.87878,20069,1
AMDIA KRISHAK SRAMIK HIGH SCHOOL,112505,School,NARAYANGANJ,RUPGANJ,BARA AMDIA,90.58056,23.84953,20070,1
KALNI HIRNAL HIGH SCHOOL,112514,School,NARAYANGANJ,RUPGANJ,BHOLANATHPUR,90.56322,23.78383,20071,1
PALKHAN HIGH SCHOOL,112508,School,NARAYANGANJ,RUPGANJ,KAMTA,90.54261,23.80644,20072,1
DAUDOUR PUTINA HIGH SCHOOL,112490,School,NARAYANGANJ,RUPGANJ,PUTINA,90.557,23.78419,20073,1
GOLAKANDAIL MOZIBUR RAHMAN BHUYAN HIGH SCHOOL,112512,School,NARAYANGANJ,RUPGANJ,GOLAKANDAIL,90.50897,23.87125,20074,1
SAHITUNNESSA PILOT GIRLS HIGH SCHOOL,112488,School,NARAYANGANJ,RUPGANJ,RUPGANJ,90.564,23.88497,20075,1
JANATA HIGH SCHOOL,112507,School,NARAYANGANJ,RUPGANJ,BRAHMANKHALI,90.55636,23.87364,20076,1
PROGOTI HIGH SCHOOL,112513,School,NARAYANGANJ,RUPGANJ,GUTIABA,90.54936,23.86447,20077,1
JANGIR HIGH SCHOOL,112486,School,NARAYANGANJ,RUPGANJ,JANGIR,90.52294,23.87797,20078,1
KAZI ABDUL HAMID HIGH SCHOOL,112499,School,NARAYANGANJ,RUPGANJ,RUPGANJ,90.57233,23.77836,20079,1
NURUL HOQUE HIGH SCHOOL,112485,School,NARAYANGANJ,RUPGANJ,KUTUBPUR,90.52719,23.779,20080,1
SONARGAON PILOT GIRLS HIGH SCHOOL,112331,School,NARAYANGANJ,SONARGAON,CHOWDONA,90.58172,23.85039,20081,1
BAIDYER BAZAR N A M PILOT HIGH SCHOOL,112343,School,NARAYANGANJ,SONARGAON,HARIA,90.56897,23.879,20082,1
HAZI MATIUR RAHMAN SARKER HIGH SCHOOL,112359,School,NARAYANGANJ,SONARGAON,PASCHIM DAMODARDI,90.54364,23.82414,20083,1
GOALPARA HIGH SCHOOL,112357,School,NARAYANGANJ,SONARGAON,GOAL PARA,90.60803,23.65664,20084,1
RIBOR PILOT GIRLS  HIGH SCHOOL,112339,School,NARAYANGANJ,SONARGAON,RIBARDI,90.60725,23.64683,20085,1
BURUMDI A L M H high SCHOOL,112345,School,NARAYANGANJ,SONARGAON,BURUMDI,90.62728,23.6765,20086,1
MAHAJAM PUR M.L.HIGH SCHOOL,112344,School,NARAYANGANJ,SONARGAON,SEKHERHAT,90.65953,23.71281,20087,1
JAMPUR MAJHER CHAR M.S.G.K. HIGH SCHOOL,112340,School,NARAYANGANJ,SONARGAON,BARA MAJHER CHAR,90.634,23.69931,20088,1
PARAB  ADARSHA HIGH SCHOOL,112351,School,NARAYANGANJ,SONARGAON,PERABA,90.63217,23.70436,20089,1
KANCHPUR OMOR ALI HIGH SCHOOL,112334,School,NARAYANGANJ,SONARGAON,KANCHPUR,90.62917,23.73569,20090,1
KAIKERTEK NAWAB HABIBULLAH HIGH SCHOOL,112342,School,NARAYANGANJ,SONARGAON,DARUGOLA,90.60975,23.75417,20091,1
MOGRAPARA H. G. G. S. SMiRITI BIDDYATON,112332,School,NARAYANGANJ,SONARGAON,CHHOTA ARJUNDI,90.56686,23.74575,20092,1
SONAKHALI JUNIOR HIGH SCHOOL,112354,School,NARAYANGANJ,SONARGAON,SONAKHALI,90.59092,23.72172,20093,1
NOAGAON HIGH SCHOOL,112353,School,NARAYANGANJ,SONARGAON,NAOGAON,90.52947,23.68875,20094,1
TAHERPUR HAZI LAL MIAH SCHOOL,112352,School,NARAYANGANJ,SONARGAON,MANGALERGAON,90.57006,23.56892,20095,1
DABIR UDDIN BHUIYA HIGH SCHOOL,112333,School,NARAYANGANJ,SONARGAON,SADIPUR,90.58411,23.63311,20096,1
PANCHAMI GHAT HIGH SCHOOL,112338,School,NARAYANGANJ,SONARGAON,PANCHAMIGHAT,90.64275,23.7315,20097,1
SADI PUR HIGH SCHOOL,112347,School,NARAYANGANJ,SONARGAON,BARAGAON,90.58286,23.61903,20098,1
CHOWDHURY GAON  HIGH SCHOOL,112349,School,NARAYANGANJ,SONARGAON,CHOWDHURYGAON,90.57858,23.72689,20099,1
HOSSAINPUR S P UNION HIGH SCHOOL,112341,School,NARAYANGANJ,SONARGAON,HOSSAINPUR,90.54258,23.729,20100,1
MADHYA CHAR HOGLA HIGH SCHOOL,112356,School,NARAYANGANJ,SONARGAON,CHAR HOGLA,90.54,23.72156,20101,1
SHAMBHUPURA HIGH SCHOOL,112307,School,NARAYANGANJ,SONARGAON,SHAMBHUPURA,90.57703,23.71419,20102,1
SONAR BANGLA HIGH SCHOOL,112346,School,NARAYANGANJ,SONARGAON,BHABANIPUR,90.56075,23.61267,20103,2
SANMADI HASAN KHAN HIGH SCHOOL,112350,School,NARAYANGANJ,SONARGAON,SANMANDI,90.56594,23.55989,20104,1
MADAN PUR RAHOMANIA HIGH SCHOOL,112380,School,NARAYANGANJ,BANDAR,MADANPUR,90.55219,23.58919,20105,1
KANCHAN VAROT CHANDRA HIGH SCHOOL,112489,School,NARAYANGANJ,RUPGANJ,KANCHAN (PART),90.56075,23.61267,20106,2
BALIAPARA HIGH SCHOOL AND COLLEGE,112305,School and College,NARAYANGANJ,ARAIHAZAR,BALIA PARA,90.66122,23.79456,26167,1
SULTANSADI HIGH SCHOOL AND COLLEGE,132151,School and College,NARAYANGANJ,ARAIHAZAR,SULTANSADI,90.62819,23.78833,26168,1
BANDAR GIRLS' SCHOOL AND COLLEGE,112378,School and College,NARAYANGANJ,BANDAR,S.S. SAHA ROAD (PART),90.67322,23.74872,26169,1
HAJI IBRAHIM ALAMCHAN model school and college,112403,School and College,NARAYANGANJ,BANDAR,MADHABPASHA,90.53375,23.58153,26170,1
SINHA UCHCHA MADHAMIK BIDDALAYA,112372,School and College,NARAYANGANJ,SONARGAON,KANCHPUR,90.55839,23.66553,26171,1
B.M.UNION SCHOOL AND COLLEGE,112379,School and College,NARAYANGANJ,BANDAR,S.S. SAHA ROAD (PART),90.55492,23.63061,26172,1
DHAKESWARI MILLS SCHOOL AND COLLEGE,112377,School and College,NARAYANGANJ,BANDAR,LAKSHANKHOLA ROAD(PART),90.55039,23.63833,26173,1
