inst name, eiin, inst_type, district, thana, mauza, long, lat, serial,isUnique
NARSINGDI GOVT. COLLEGE,112719,College,NARSINGDI,NARSINGDI SADAR,BHELANAGAR,90.722992,23.933495,1434,1
NARSINGDI GOVT. MOHILA COLLEGE,112718,College,NARSINGDI,NARSINGDI SADAR,DAKSHIN BIRAMPUR,90.723488,23.932486,1435,1
RAIPURA COLLEGE,112817,College,NARSINGDI,ROYPURA,CHANDERKANDI,90.78717,23.93117,1436,1
PALASH SHILPANCHAL COLLEGE,112758,College,NARSINGDI,PALASH,PALASH BAZAR,90.88675,23.95869,1437,2
GHORASHAL MUSHA BIN HAKIM COLLEGE,112757,College,NARSINGDI,PALASH,CHAMRABO,90.62856,23.97122,1438,1
MADHABDI COLLEGE,112715,College,NARSINGDI,NARSINGDI SADAR,CHHATO GODAIR CHAR (PART),90.67992,23.96811,1439,1
MADHABDI DIGITAL COLLEGE,131872,College,NARSINGDI,NARSINGDI SADAR,BIRAMPUR(PART),90.63333,23.94906,1440,1
ABDUL KADIR MOLLAH CITY COLLEGE,132043,College,NARSINGDI,NARSINGDI SADAR,BASAIL (ELASAI),90.67603,23.85169,1441,1
NARSHINGDI MODEL COLLEGE,112716,College,NARSINGDI,NARSINGDI SADAR,BHELANAGAR,90.80339,23.89011,1442,1
SHILMANDI ADARSHA COLLEGE,131871,College,NARSINGDI,NARSINGDI SADAR,SILMANDI,90.68142,23.89931,1443,1
BARACHAPA MOHA BIDDALAY,112652,College,NARSINGDI,MANOHARDI,BARA CHAPA,90.77842,24.20072,1444,1
BARACHAPA UNION ADARSHA DEGREE COLLeGe,112654,College,NARSINGDI,MANOHARDI,NOANAGAR,90.74889,24.19228,1445,1
MONOHARDI DEGREE COLLEGE,112655,College,NARSINGDI,MANOHARDI,DAKSHIN CHANDANBARI,90.69669,24.16964,1446,1
HATIRDIA RAZIUDDIN COLLEGE,112657,College,NARSINGDI,MANOHARDI,HATIRDIA,90.70336,24.09911,1447,1
PANCH KANDI DEGREE COLLEGE,112659,College,NARSINGDI,MANOHARDI,GOTASHIA,90.75117,24.12794,1448,1
 AFAZUDDIN KHAN MOHILA  COLLEGE,112653,College,NARSINGDI,MANOHARDI,KHARABA,90.75831,24.16506,1449,1
KHIDIRPUR COLLEGE,112658,College,NARSINGDI,MANOHARDI,KHIDIRPUR (PART-1),90.73625,24.19875,1450,1
BAROICHA COLLEGE,112574,College,NARSINGDI,BELABO,PURBA UJILABA,90.86461,24.06656,1451,1
HOSSAIN ALI COLLGE,112575,College,NARSINGDI,BELABO,BELABO,90.79897,24.10933,1452,1
NARAYANPUR RABEYA COLLEGE,112573,College,NARSINGDI,BELABO,NARAYANPUR,90.90122,24.06533,1453,1
PORADIA WASIM UDDIN KHAN DEGREE COLLEGE,112576,College,NARSINGDI,BELABO,PORADIA,90.80906,24.13822,1454,1
LAKHPUR SHIMULIA COLLEGE,112879,College,NARSINGDI,SHIBPUR,CHAR LAKHPUR,90.82156,24.14578,1455,1
SHIBPUR GOVT. SHAHID ASAD COLLEGE. SHIBPUR. NARSINGDI,112881,College,NARSINGDI,SHIBPUR,DHANUA,90.68953,24.05185,1456,1
JOYNAGAR DEGREE COLLEGE,112882,College,NARSINGDI,SHIBPUR,AJKITALA,90.73693,24.07611,1457,1
SABUJ PAHAR COLLEGE,112880,College,NARSINGDI,SHIBPUR,JOSAR,90.81082,24.06639,1458,1
ABDUL MANNAN BHUIYAN COLLEGE,112883,College,NARSINGDI,SHIBPUR,BANGSIRDIA,90.81517,24.00525,1459,1
RAHIMA HOQUE CHETONA BIKASH MOHILA COLLEGE,112818,College,NARSINGDI,ROYPURA,CHANDERKANDI,90.68693,24.02182,1460,1
KARIM GANJ DARUL ULUM  ALIM MADRASAH,112804,Madrasha,NARSINGDI,ROYPURA,HASNABAD,90.87078,23.99483,7545,1
CHARSUBUDDHI FAZIL MADRASAH,112808,Madrasha,NARSINGDI,ROYPURA,CHAR SUBUDDI,90.90611,24.00044,7546,1
LAKSHMIPURA RAHE JANNAT DAKHIL MADRASAH,112814,Madrasha,NARSINGDI,ROYPURA,DAUKAR CHAR,90.88272,23.89372,7547,1
AMIRABAD HOSSAINIA DAKHIL MADRASHA,112805,Madrasha,NARSINGDI,ROYPURA,FATEHPUR,90.81981,23.96578,7548,1
PALASHTALI KASEMUL ULUM DAKHIL MADRASAH,112812,Madrasha,NARSINGDI,ROYPURA,TULATALI(PART),90.92317,24.02017,7549,1
RAIPURA UPAZILA DAKHIL MADRASAH,112807,Madrasha,NARSINGDI,ROYPURA,CHANDERKANDI,90.89694,23.95986,7551,2
PAIKASHA DAKHIL MADRASA,112755,Madrasha,NARSINGDI,PALASH,PAIKSA,90.86458,24.03581,7552,2
DAKHIN DEWRA DESHGARI ADARSHA BALIKA DAKHIL MADRASA,112756,Madrasha,NARSINGDI,PALASH,DAKSHIN DEORA,90.62742,23.94031,7553,1
DANGA JAMEAYA ASHRAFUL ULUM DAKHIL MADRASA,112754,Madrasha,NARSINGDI,PALASH,HASANHATA,90.67358,23.97764,7554,1
KAZAIR A. U. ISLAMIA DAKHIL MADRASA,112749,Madrasha,NARSINGDI,PALASH,KAJAIR,90.64158,23.98528,7555,1
KHILPARA DARUL ULUM ALIM MADRASAH,112753,Madrasha,NARSINGDI,PALASH,KHIL PARA,90.59464,23.89069,7556,1
GAZARIA MADINATUL ULUM DAKHIL MADRASA,112750,Madrasha,NARSINGDI,PALASH,ICHHAKHALI,90.61575,23.92447,7557,1
ISAKHALI FAZIL DEGREE MADRASAH,112752,Madrasha,NARSINGDI,PALASH,ICHHAKHALI,90.59489,23.89242,7558,1
ISLAMABAD DARUSNNA DAKHIL MADRASHA,112709,Madrasha,NARSINGDI,NARSINGDI SADAR,CHATTO RAMCHANDRADI,90.65461,23.97672,7559,1
JAMEA-E-EMDADIA DAKHIL MADRASHA,112701,Madrasha,NARSINGDI,NARSINGDI SADAR,CHHOTA MADHABDI( PART),90.6815,23.93881,7560,1
MADRASHAEY GAUCHIA PESHWARIA SUNNIA ALIM MADRASAH,112704,Madrasha,NARSINGDI,NARSINGDI SADAR,BASAIL (ELASAI),90.67636,23.83561,7561,1
CHAR MADHABPUR MADINATUL ULUM DAKHIL MADRASHA,112712,Madrasha,NARSINGDI,NARSINGDI SADAR,CHAR MADHABPUR,90.69983,23.92539,7562,1
BHUIYAM ISLAMIA DAKHIL MADRASHA,112703,Madrasha,NARSINGDI,NARSINGDI SADAR,BHUM,90.71853,23.91844,7563,1
CHINISHPUR ABU BAKAR ISLAMIA DAKHIL MADRASHA,112714,Madrasha,NARSINGDI,NARSINGDI SADAR,NANDI PARA (CHINISHPUR),90.80933,23.88611,7564,1
SREE NAGAR ISHAKIA DAKHIL MADRASHA,112699,Madrasha,NARSINGDI,NARSINGDI SADAR,KALIKAPUR,90.69628,23.93383,7565,1
RAHIMDI DAKHIL MADRASHA,112706,Madrasha,NARSINGDI,NARSINGDI SADAR,RAHIMDI,90.74678,23.89083,7566,1
GADAIR CHAR ASIA ISLAMIA ALIM KADRASHA,112708,Madrasha,NARSINGDI,NARSINGDI SADAR,GADAIR CHAR(PART),90.66886,23.81361,7567,1
PAULANPUR ISLAMIA FAZIL MADRASAH,112700,Madrasha,NARSINGDI,NARSINGDI SADAR,PAULANPUR,90.65747,23.83242,7568,1
NAZARPUR UNION BATTALA DAKHIL MADRASHA,112697,Madrasha,NARSINGDI,NARSINGDI SADAR,DILARPUR,90.69281,23.876,7569,1
BAGHATA ISLAMIA DAKHIL MADRASA,112711,Madrasha,NARSINGDI,NARSINGDI SADAR,BAGHATA,90.74439,23.89281,7570,1
SEKHER CHAR SAH ABDUL KHALED DAKHIL MADRASHA,112707,Madrasha,NARSINGDI,NARSINGDI SADAR,SEKHER CHAR,90.72961,23.89547,7571,1
SHILMANDI JAMEA-E-ISLAMIA DAKHIL MADRASHA,112710,Madrasha,NARSINGDI,NARSINGDI SADAR,SILMANDI,90.70586,23.83442,7572,1
B.M. PORADIA ALIM MADRASA,112568,Madrasha,NARSINGDI,BELABO,PORADIA,90.68075,23.92558,7573,1
BARACHAPA ML ISLAMIA ALIM MADRASAH,112625,Madrasha,NARSINGDI,MANOHARDI,BARA CHAPA,90.77786,24.19511,7575,1
CHANDAN BARI ISLAMIA FAZIL MADRASAH,112642,Madrasha,NARSINGDI,MANOHARDI,UTTAR CHANDANBARI,90.7335,24.19078,7576,1
LAKHPUR K.U.  SENIOR FAZIL MADRASAH,112633,Madrasha,NARSINGDI,MANOHARDI,CHANDANBARI (PART),90.72461,24.17139,7577,1
PACHIM BIRGAON BALIKA DAKHIL MADRASHA,112647,Madrasha,NARSINGDI,MANOHARDI,KHIDIRPUR (PART-2),90.75844,24.22186,7578,1
KOCHER CHAR ISLAMIA DAKHIL MADRASAH,112644,Madrasha,NARSINGDI,MANOHARDI,KOCHER CHAR,90.77489,24.23758,7579,1
MONTALA ASRAFIA GIRLS DAKHIL MADRASA,112648,Madrasha,NARSINGDI,MANOHARDI,CHAR MANDALIA (PART-2),90.77547,24.23786,7580,1
BIRGAON ISLAMIA DAKHIL MARASH,112643,Madrasha,NARSINGDI,MANOHARDI,KHIDIRPUR (PART-2),90.7755,24.20589,7581,1
KRISHNAPUR BOHUMOKHI GIRSL DAKHIL MADRASAH,112649,Madrasha,NARSINGDI,MANOHARDI,KRISHNAPUR,90.76494,24.20594,7582,1
DAULATPUR DARUL ULAM DAKHIL MADRASHA,112637,Madrasha,NARSINGDI,MANOHARDI,DAULATPUR,90.77336,24.22722,7583,1
HORINARAYANPUR JAMEUL ULUM FAZIL MADRASAH,112635,Madrasha,NARSINGDI,MANOHARDI,HARINARAYANPUR,90.77153,24.20947,7584,1
GOKHALA LULUYA  DEEN ISLAMIA DAKHIL MADASHA,112645,Madrasha,NARSINGDI,MANOHARDI,GOKHULA,90.64861,24.087,7585,1
MONOHARDI DARUL ISLAM DAKHIL MADRASAH,112628,Madrasha,NARSINGDI,MANOHARDI,NALUA CHAK,90.71428,24.07639,7586,1
G.K.P.DOAIGAON RABIUL ULUM DAKHIL MADRASAH,112641,Madrasha,NARSINGDI,MANOHARDI,DOAIGAON,90.78775,24.11061,7587,1
SHARBALAKHANA ALIM MADRASHA,112634,Madrasha,NARSINGDI,MANOHARDI,SARBALAK SHANA,90.76669,24.12661,7588,1
PANCHASKUR DAKIL MADRASAH,112629,Madrasha,NARSINGDI,MANOHARDI,KANCHIKATA,90.74958,24.11083,7589,1
SHAKER Tek AL JAMIATUL ISlamia  DAKHIL MADRASAH,112627,Madrasha,NARSINGDI,MANOHARDI,SEKHERTEK,90.75408,24.10842,7590,1
BIR AHAMMAD PUR D.U DAKHIL MADRASA,112640,Madrasha,NARSINGDI,MANOHARDI,KISMAT AHMEDPUR,90.76408,24.21458,7591,1
CHARSAGARDI ALIM MADRASHA,112636,Madrasha,NARSINGDI,MANOHARDI,CHAR SAGARDI,90.73322,24.16025,7592,1
MANTOLA ISLAMIA SENIOR FAZIL MADRASHA,112626,Madrasha,NARSINGDI,MANOHARDI,CHAR MANDALIA (PART-2),90.73728,24.23161,7593,1
DHARABANDA FAZIL MADRASHA,112630,Madrasha,NARSINGDI,MANOHARDI,DHARUBANDHA,90.70108,24.23661,7594,1
SHAKHERGOAN J.U. SR. FAZIL MADRASAH,112632,Madrasha,NARSINGDI,MANOHARDI,SEKHERGAON,90.67794,24.21656,7595,1
TATARDI MIRDHA BARI GIRLS ALIM MADRASA,112646,Madrasha,NARSINGDI,MANOHARDI,TATIRDI,90.71533,24.21233,7596,1
TARAKANAI T.Q. A.H GIRLS DHAKIL MADRASAH,112638,Madrasha,NARSINGDI,MANOHARDI,TARAKANDI,90.68606,24.19553,7597,1
DASHSONA ISLAMIA FAZIL MADRASHA,112631,Madrasha,NARSINGDI,MANOHARDI,DASDONAR CHAK,90.69139,24.19386,7598,1
DHAKKIN BOTESHWAR SHABUJ PALLY DAKHIL MADRASHA,112564,Madrasha,NARSINGDI,BELABO,AMLABA,90.85958,24.08497,7599,1
CHITAIN  DAKHIL MADRASA,112569,Madrasha,NARSINGDI,BELABO,CHITAM,90.82583,24.07706,7600,1
CHARBELABO FAZIL DEGREE MADRASAH,112566,Madrasha,NARSINGDI,BELABO,CHAR LAKSHMIPUR,90.82225,24.10531,7601,1
BINNABAID DARUL ULUM DAKHIL MADRASA,112567,Madrasha,NARSINGDI,BELABO,BINYABAID,90.85239,24.09936,7602,1
DULAL KANDI DAKHIL MADRASA,112571,Madrasha,NARSINGDI,BELABO,JOAR LAKSHMIPUR,90.88989,24.06556,7603,1
SUTARIA F. H. KHAN DAKHIL MADRASA,112570,Madrasha,NARSINGDI,BELABO,NAGAR NALUAKOT,90.80306,24.12628,7604,1
SARRABAD HAZI AFTAB UDDIN DHAKIL MADRASHA,112565,Madrasha,NARSINGDI,BELABO,SARRABAD,90.93053,24.07408,7605,1
LAKHPUR MOHILA DAKHIL MADRASAH,112873,Madrasha,NARSINGDI,SHIBPUR,LAKHPUR,90.83736,24.14706,7608,2
GARBARI TAZBIDUL QURAN DAKHIL MADRASAH,112866,Madrasha,NARSINGDI,SHIBPUR,NAGAR MAHESHWARDI,90.64132,24.06857,7609,1
DULALPUR SENIOR FAZIL MADRASHA,112869,Madrasha,NARSINGDI,SHIBPUR,DULALPUR,90.67194,24.07309,7610,1
MASIMPUR ASHRAFUL ULUM DAKHIL MADRASA,112868,Madrasha,NARSINGDI,SHIBPUR,MASIMPUR,90.7004,24.06387,7611,1
S.K.B DAKHIL MADRASA,112861,Madrasha,NARSINGDI,SHIBPUR,KHUPI,90.68261,24.0477,7612,1
KUMRADI DARUL ULUM SENIOR FAZIL MADRASHA,112864,Madrasha,NARSINGDI,SHIBPUR,KUMDTRADI,90.67792,24.02477,7613,1
NOADIA KHAISHA KHALI D.U.GIRLS DAKHIL MADRASA,112862,Madrasha,NARSINGDI,SHIBPUR,KHAISHAKHALI,90.70985,23.94465,7614,1
NOADIA KHAISHAKHALI FAZIL MADRASHA,112865,Madrasha,NARSINGDI,SHIBPUR,KHAISHAKHALI,90.7269,23.94624,7615,1
BAGHABO DARUL ULUM DAKHIL MADRASA,112874,Madrasha,NARSINGDI,SHIBPUR,BAGHABA,90.77316,23.97982,7616,1
BAROYGAON JAMIUL ULUM SENIOR ALIM MADRASHA,112872,Madrasha,NARSINGDI,SHIBPUR,BARAIGAON,90.75329,24.02738,7617,1
AZDEETOLA H.M.A. ALI DAKHIL MADRASA,112870,Madrasha,NARSINGDI,SHIBPUR,MAISHARTEK,90.74073,24.0804,7618,1
JOYNAGAR DARUL ULUM  DAKHIL MADRASA,112871,Madrasha,NARSINGDI,SHIBPUR,AJKITALA,90.77777,24.06968,7619,1
KHAMAR SHIMULIA DAKHIL MADRASA,112876,Madrasha,NARSINGDI,SHIBPUR,ALINAGAR,90.80983,24.03568,7620,1
SHARIFPUR MOHAMMADIA DAKHIL MADRASA,112867,Madrasha,NARSINGDI,SHIBPUR,JOSAR,90.81103,24.02061,7621,1
DHANUA BALIKA DAKHIL MADRASA,112863,Madrasha,NARSINGDI,SHIBPUR,DHANUA,90.81847,24.02463,7622,1
KHARIA TAMIRUL MILLAT DAKHIL MADRASA,112877,Madrasha,NARSINGDI,SHIBPUR,KHARIA,90.80084,24.01565,7623,1
SERAJ NAGAR UMMUL QURA  ALIM MADRASHA,112811,Madrasha,NARSINGDI,ROYPURA,ADIABAD,90.75722,23.95872,7624,1
KOHINOOR JUTE MILL HIGH SCHOOL,112788,School,NARSINGDI,ROYPURA,GAURIPUR,90.39212,23.72576,20108,1
HASNABAD HIGH SCHOOL,112784,School,NARSINGDI,ROYPURA,HASNABAD,90.89717,23.96003,20113,1
SHATADAL GIRLS HIGH SCHOOL,112798,School,NARSINGDI,ROYPURA,SREENIDHI,90.76986,23.92617,20114,1
CHARMODHUA  ADARSHA HIGH SCHOOL,112793,School,NARSINGDI,ROYPURA,CHAR MADHUA,90.77367,23.93233,20115,1
ABDULLA PUR HIGH SCHOOL,112767,School,NARSINGDI,ROYPURA,ABDULLAPUR,90.75664,23.93089,20116,1
CHAR SUBUDDI JINIOR HIGH SCHOOL,112777,School,NARSINGDI,ROYPURA,CHAR SUBUDDI,90.78653,23.96639,20117,1
BELAYET ALI HIGH SCHOOL,112787,School,NARSINGDI,ROYPURA,ADIABAD (PART),90.86686,23.99567,20118,1
EUNUS MIAH GIRLS HIGH SCHOOL,112778,School,NARSINGDI,ROYPURA,HAIRMARA,90.82503,23.93403,20119,1
MONIPURA HIGH SCHOOL,112771,School,NARSINGDI,ROYPURA,HAIRMARA,90.81278,23.93919,20120,1
CHARA BAG IDEAL HIGH SCHOOL,112799,School,NARSINGDI,ROYPURA,MARJAL,90.81269,23.93903,20121,1
MARJAL GIRLS HIGH SCHOOL,112791,School,NARSINGDI,ROYPURA,MARJAL,90.77506,23.95517,20122,1
ISLAMPUR M L HIGH SCHOOL,112785,School,NARSINGDI,ROYPURA,HATUBHANGA,90.76844,23.95356,20123,1
MAHMUDABAD RAZIUDDIN AHAMED RAZU  HIGH SCHOOL,112801,School,NARSINGDI,ROYPURA,MAMUDABAD,90.81186,23.93075,20124,1
PIRIJ KANDI HIGH SCHOOL,112770,School,NARSINGDI,ROYPURA,PIRAJKANDI,90.80906,23.92617,20125,1
SABDAR ALI KHAN HIGH SCHOOL,112790,School,NARSINGDI,ROYPURA,NILAKHYA,90.85378,24.04128,20126,1
NILAKHIA ABUL HASHEM HIGH SCHOOL,112782,School,NARSINGDI,ROYPURA,NILAKHYA,90.84117,24.04128,20127,1
GOBINDAPUR HIGH SCHOOL,112786,School,NARSINGDI,ROYPURA,DAKSHIN GOBINDAPUR,90.93661,24.05397,20128,1
PARATALI KALIM UDDIN HIGH SCHOOL,112775,School,NARSINGDI,ROYPURA,HOSSAIN NAGAR,90.8485,23.89839,20129,1
RAIPURA PILOT GIRLS HIGH SCHOOL,112774,School,NARSINGDI,ROYPURA,RAIPURA (PART),90.83256,23.91267,20130,1
BHALUAR CHAR HIGH SCHOOL,112800,School,NARSINGDI,ROYPURA,SREENAGAR,90.84975,24.003,20131,1
SAIDABAD HIGH SCHOOL,112776,School,NARSINGDI,ROYPURA,SREENAGAR,90.9065,23.95725,20132,1
B B L  HIGH SCHOOL,112797,School,NARSINGDI,ROYPURA,BARA CHAR,90.88078,23.98225,20133,1
UTTAR BAKHAR NAGAR UNION HIGH SCHOOL,112792,School,NARSINGDI,ROYPURA,UTTAR BAKHARNAGAR,90.87911,23.98136,20134,1
SERAJ NAGAR M A PILOT model  HIGH SCHOOL,112766,School,NARSINGDI,ROYPURA,CHANDERKANDI,90.88675,23.95869,20135,2
BALUAKNADI HIGH SCHOOL,112769,School,NARSINGDI,ROYPURA,BALUAKANDI,90.87264,24.02867,20136,2
DAKHIN MIRZA NAGAR  ASMATENNESA GIRLS HIGH SCHOOL,112783,School,NARSINGDI,ROYPURA,DAKSHIN MIRZANAGAR,90.86458,24.03581,20137,2
SAMABAYA ADARSHA BIDDANIKETAN,112744,School,NARSINGDI,PALASH,KUTIR PARA,90.85669,23.95814,20138,1
JANATA ADARSHA BIDYAPITH,112739,School,NARSINGDI,PALASH,CHAR PALASH,90.89694,23.95986,20139,2
KARTATAIL ADARSHA HIGH SCHOOL,112747,School,NARSINGDI,PALASH,KARTATAIL,90.87264,24.02867,20140,2
FAUJI ADARSHA HIGH SCHOOL,112742,School,NARSINGDI,PALASH,KHANEPUR,90.62206,23.96783,20141,1
KHANEPUR HIGH SCHOOL,112736,School,NARSINGDI,PALASH,KHANEPUR,90.62911,23.92867,20142,1
PALASH SARKARKHANA HIGH SCHOOL,112725,School,NARSINGDI,PALASH,KHANEPUR,90.62347,23.94472,20143,1
DANGA HIGH SCHOOL,112729,School,NARSINGDI,PALASH,HASANHATA,90.64086,23.99636,20144,1
JOYNAGAR GIRLS HIGH SCHOOL,112737,School,NARSINGDI,PALASH,BIRINDA,90.64875,23.98353,20145,1
PUBALI JUTE MILLS HIGH SCHOOL,112726,School,NARSINGDI,PALASH,KHIL PARA,90.65125,23.98533,20146,1
KHUDI MAHMUD GIRLS HIGH SCHOOL,112743,School,NARSINGDI,PALASH,RAMANANDI,90.59533,23.90072,20147,1
PALASH THANA HIGH SCHOOL,112724,School,NARSINGDI,PALASH,GABTALI (PART),90.58383,23.91458,20148,1
GAYESHPUR PADMALOCAHN HIGH SCHOOL,112730,School,NARSINGDI,PALASH,BARAR CHAR,90.6185,23.92189,20149,1
PARULIA HIGH SCHOOL,112728,School,NARSINGDI,PALASH,NAGAR NARASINGPUR,90.68586,23.96625,20150,1
RABAN HIGH SCHOOL,112722,School,NARSINGDI,PALASH,RABAN,90.70864,23.9685,20151,1
SANER  BARI  HIGH SCHOOL,112745,School,NARSINGDI,PALASH,SANERBARI (CHAR PARA),90.68144,23.97953,20152,1
NARASINGDI PILOT HIGH SCHOOL,112670,School,NARSINGDI,NARSINGDI SADAR,TOROA,90.66931,23.8545,20153,1
ALIJAN J.M. ACADEMY,112678,School,NARSINGDI,NARSINGDI SADAR,DAKSHIN BIRAMPUR,90.67347,23.84811,20154,1
ALOKBALI A.M.C. HIGH SCHOOL,112686,School,NARSINGDI,NARSINGDI SADAR,ALOKBALI,90.70425,23.92958,20155,1
BONAID BABU MIA HIGH SCHOOL,112690,School,NARSINGDI,NARSINGDI SADAR,BANBHAG,90.70767,23.93456,20156,1
SHAHED BUDDIJIBI PROF.GHYASUDDIN AHMAD GIRLS high SCHOOL,112692,School,NARSINGDI,NARSINGDI SADAR,BELABO,90.72272,23.91844,20157,1
BADUAR CHAR KAZI ABUL HASHEM HIGH SCHOOL,112688,School,NARSINGDI,NARSINGDI SADAR,BADUAR CHAR,90.62078,23.86975,20158,1
HAZIPUR NASIR UDDIN MEMRIAL HIGH SCHOOL,112664,School,NARSINGDI,NARSINGDI SADAR,HAJIPUR,90.63583,23.90933,20159,1
SAFURA KHATUN GIRLS HIGH SCHOOL,112695,School,NARSINGDI,NARSINGDI SADAR,KARIMPUR,90.62836,23.90644,20160,1
RASULPUR HIGH SCHOOL,112681,School,NARSINGDI,NARSINGDI SADAR,KARIMPUR,90.72189,23.93431,20161,1
BHuIyaM  HIGH  SCHOOL,112682,School,NARSINGDI,NARSINGDI SADAR,BHUM,90.74253,23.931,20162,1
KATHALIA UNION HIGH SCHOOL,112663,School,NARSINGDI,NARSINGDI SADAR,NAYAKANDI,90.72994,23.92525,20163,1
MADHABDI  S. P. INSTITUTION,112669,School,NARSINGDI,NARSINGDI SADAR,DAKSHIN BIRAMPUR (PART),90.76392,23.87828,20164,1
NURALA PUR HIGH SCHOOL,112685,School,NARSINGDI,NARSINGDI SADAR,NURALAPUR,90.62653,23.90258,20165,1
BALUSHAIR HIGH SCHOOL,112687,School,NARSINGDI,NARSINGDI SADAR,BALUSAIR,90.64739,23.82239,20166,1
PANCHDONA SIR K.G. GUPTA high school,112679,School,NARSINGDI,NARSINGDI SADAR,PANCHDONA,90.69164,23.91897,20167,1
NARSINGDI UCHCHA BALIKA BIDYA NIKETAN,112672,School,NARSINGDI,NARSINGDI SADAR,DAKSHIN BIRAMPUR,90.672,23.85225,20168,1
MUTIULLAH BHUYA HIGH SCHOOL,112683,School,NARSINGDI,NARSINGDI SADAR,DILARPUR,90.66642,23.83586,20169,1
BALAPUR N.C HIGH SCHOOL,112680,School,NARSINGDI,NARSINGDI SADAR,BARA BALAPUR,90.66397,23.89081,20170,1
BAGHATA NUR AFAB ADARSHA BIDDYPITH,112675,School,NARSINGDI,NARSINGDI SADAR,BAGHATA,90.71586,23.92211,20171,1
SHILMANDI TAHERA ASMAT HIGH SCHOOL,112691,School,NARSINGDI,NARSINGDI SADAR,SILMANDI,90.66681,23.87306,20172,1
BARACHAPA GIRLS HIGH SCHOOL,112579,School,NARSINGDI,MANOHARDI,BARA CHAPA,90.68194,23.89864,20173,1
BARACHAPA HIGH SCHOOL,112589,School,NARSINGDI,MANOHARDI,BARA CHAPA,90.67344,23.87267,20174,1
BIR MAIZADIA ADARSHA JR. HIGH KARIGARI PROTISTHAN,112615,School,NARSINGDI,MANOHARDI,BIR MAIJDIA,90.68078,23.92275,20175,1
JAMALPUR ADARSHA HIGH SCHOOL,112616,School,NARSINGDI,MANOHARDI,JAMALPUR,90.68181,23.91769,20176,1
CHALAKCHAR HIGH SCHOOL,112580,School,NARSINGDI,MANOHARDI,CHALAK CHAR,90.79569,24.18953,20177,1
CHALAK CHAR GIRLS HIGH SCHOOL,112607,School,NARSINGDI,MANOHARDI,CHALAK CHAR,90.78353,24.16931,20178,1
MADHUPUR high SCHOOL,112606,School,NARSINGDI,MANOHARDI,MADHUPUR (PART),90.77183,24.187,20179,1
ARJUNCHAR GIRL'S HIGH SCHOOL,112590,School,NARSINGDI,MANOHARDI,ARJUN CHAR (PART),90.78194,24.19975,20180,1
MANOHARDI PILOT HIGH SCHOOL,112584,School,NARSINGDI,MANOHARDI,DAKSHIN CHANDANBARI,90.75869,24.19964,20181,1
CHANDANBARI S.A.PILOT GIRL'S HIGH SCHOOL,112586,School,NARSINGDI,MANOHARDI,UTTAR CHANDANBARI,90.73272,24.19083,20182,1
BIRGAON HIGH SCHOOL,112609,School,NARSINGDI,MANOHARDI,KHIDIRPUR (PART-2),90.69542,24.14697,20183,1
CHARMANDALIA HIGH SCHOOL,112602,School,NARSINGDI,MANOHARDI,CHAR MANDALIA (PART-1),90.699,24.14947,20184,1
CHARMANDALIA  JUNIOR GIRLS HIGH SCHOOL,112581,School,NARSINGDI,MANOHARDI,CHAR MANDALIA (PART-1),90.72028,24.18022,20185,1
NAZUMAN NESA NIMNO MADDOMIK BALIKA BIDDALOY,112622,School,NARSINGDI,MANOHARDI,KRISHNAPUR,90.69839,24.14417,20186,1
KRISHNAPUR ADARSHA HIGH SCHOOL,112618,School,NARSINGDI,MANOHARDI,KRISHNAPUR,90.69772,24.0975,20187,1
DAULAT PUR UNION HIGH SCHOOL,112603,School,NARSINGDI,MANOHARDI,DAULATPUR,90.75381,24.22611,20188,1
H.K. BIPUL SMRITY  HIGH SCHOOL,112611,School,NARSINGDI,MANOHARDI,HARINARAYANPUR,90.68075,24.08533,20189,1
KOCHARCHAR MUKSUD ALI GIRL'S HIGH SCHOOL,112612,School,NARSINGDI,MANOHARDI,KOCHER CHAR,90.74244,24.23431,20190,1
EKDUARIA HIGH SCHOOL,112601,School,NARSINGDI,MANOHARDI,EAKDUARIA,90.66086,24.09233,20191,1
HATIRDIA SADAT ALI MODEL HIGH SCHOOL,112582,School,NARSINGDI,MANOHARDI,HATIRDIA,90.64786,24.08608,20192,1
NOADIA GIRLS HIGH SCHOOL,112600,School,NARSINGDI,MANOHARDI,NADHAIR,90.67661,24.09361,20193,1
SHAHABUDDIN MEMORIAL ACADEMY,112577,School,NARSINGDI,MANOHARDI,UTTAR ALGI,90.65992,24.08028,20194,1
BAGHIBaRI  MaHMUDA  MOTIUR  RAHMAN  HIGH  SCHOOL,112597,School,NARSINGDI,MANOHARDI,CHULA,90.73503,24.08928,20195,1
BAGHIBARI LT. GN.  NURUDDIN KHAN JUNIOR SCHOOL,112621,School,NARSINGDI,MANOHARDI,CHULA,90.70361,24.09064,20196,1
GOTASHIA SHUKUR MAHMUD HIGH SCHOOL,112587,School,NARSINGDI,MANOHARDI,GOTASHIA,90.728,24.08692,20197,1
GOTASHIYA NURUL MOJID HUMAYON HIGH SCHOOL,112624,School,NARSINGDI,MANOHARDI,BRAHMANHATA,90.70436,24.13575,20198,1
PANCH KANDI  HIGH SCHOOL,112595,School,NARSINGDI,MANOHARDI,GOTASHIA,90.70319,24.10003,20199,1
THEKERKANDA D.S.K. HIGH SCHOOL,112599,School,NARSINGDI,MANOHARDI,DOAIGAON,90.77942,24.11597,20200,1
GHOSHGOAN HIGH SCHOOL,112604,School,NARSINGDI,MANOHARDI,DAKSHIN GHOSHGAON,90.75333,24.10578,20201,1
AFAZUDDIN KHAN GIRLS HIGH SCHOOL,112614,School,NARSINGDI,MANOHARDI,KHARABA,90.74517,24.13783,20202,1
MADHUSHAL HIGH SCHOOL,112596,School,NARSINGDI,MANOHARDI,MADHUSHAL,90.76783,24.13186,20203,1
L K UNION ML HIGH SCHOOL,112585,School,NARSINGDI,MANOHARDI,KHIDIRPUR (PART-1),90.76406,24.1405,20204,1
DOMANMARA HIGH SCHOOL,112605,School,NARSINGDI,MANOHARDI,KHIDIRPUR (PART-2),90.73247,24.14744,20205,1
KHIDIRPUR M.L HIGH SCHOOL,112578,School,NARSINGDI,MANOHARDI,KHIDIRPUR (PART-1),90.76344,24.15539,20206,1
PEERPUR GIRLS HIGH ACHOOL,112594,School,NARSINGDI,MANOHARDI,PIRPUR,90.75292,24.14683,20207,1
RAMPUR HIGH SCHOOL,112623,School,NARSINGDI,MANOHARDI,KHIDIRPUR (PART-1),90.71742,24.21392,20208,1
CHAKTATARDI ALHAJ LION M.A. BATEN GIRLS H/S,112593,School,NARSINGDI,MANOHARDI,TATIRDI,90.72253,24.23758,20209,1
J.R.S.HIGH SCHOOL,112620,School,NARSINGDI,MANOHARDI,JHAL PARA,90.72231,24.20533,20210,1
LABUTALA HIGH SCHOOL,112588,School,NARSINGDI,MANOHARDI,LEMUTALA,90.71425,24.226,20211,1
SAGARDI GIRL'S HIGH SCHOOL,112610,School,NARSINGDI,MANOHARDI,NARENDRAPUR,90.73403,24.23514,20212,1
NOAKANDI HAZI ALIM UDDIN HIGH SCHOOL,112583,School,NARSINGDI,MANOHARDI,TARAKANDI,90.73567,24.23219,20213,1
TARAKANDI HIGH SCHOOL,112608,School,NARSINGDI,MANOHARDI,LEMUTALA,90.70186,24.19547,20214,1
NARANDI ALAUDDIN NOORANI GIRLS HIGH SCHOOL,112591,School,NARSINGDI,MANOHARDI,NARANDI,90.68147,24.21431,20215,1
SUKANDI NAZIM UDDIN HIGH SCHOOL,112598,School,NARSINGDI,MANOHARDI,SHUKUNDI,90.70461,24.2225,20216,1
BARAICHA GIRLS HIGH SCHOOL,112554,School,NARSINGDI,BELABO,PURBA AMLABA,90.69533,24.19922,20217,1
BOTESHWAR ADARSA HIGH SCHOOL,112549,School,NARSINGDI,BELABO,AMLABA,90.67947,24.20539,20218,1
CHAR AMLABO MADHYAMIK VIDYALAYA,112562,School,NARSINGDI,BELABO,PURBA UJILABA,90.69778,24.12206,20219,1
DEWANER CHAR MADHYAMIK VIDYALAYA,112559,School,NARSINGDI,BELABO,PURBA UJILABA,90.72281,24.11964,20220,1
DHUKUNDI HIGH SCHOOL,112548,School,NARSINGDI,BELABO,UJILABA (CHAR MEGHNA),90.70092,24.11356,20221,1
LAKHPUR HIGH SCHOOL,112557,School,NARSINGDI,BELABO,UJILABA (CHAR MEGHNA),90.87117,24.05094,20222,1
RAJARBAG M.L. HIGH SCHOOL,112547,School,NARSINGDI,BELABO,AMLABA,90.82411,24.08556,20223,1
BAZNABO GIRLS HIGH SCHOOL,112558,School,NARSINGDI,BELABO,BAJNABA,90.85772,24.05089,20224,1
DAKSHIN DHURU HIGH SCHOOL,112546,School,NARSINGDI,BELABO,DAKSHIN DHURU,90.83044,24.06969,20225,1
HARI SHANGAN HIGH SCHOOL,112540,School,NARSINGDI,BELABO,HARISENAGAR,90.83867,24.08269,20226,1
BELABO PILOT MODERN HIGH SCHOOL,112545,School,NARSINGDI,BELABO,BELABO,90.87322,24.05408,20227,1
BELABO GIRLS HIGH SCHOOL,112555,School,NARSINGDI,BELABO,BELABO,90.83844,24.1125,20228,1
BINNABAID M.L. HOGH SCHOOL,112544,School,NARSINGDI,BELABO,BINYABAID,90.81228,24.11392,20229,1
BINNABAID JUNIOR GIRLS HIGH SCHOOL,112561,School,NARSINGDI,BELABO,BINYABAID,90.85189,24.10347,20230,1
BHATEAR CHAR HIGH SCHOOL,112563,School,NARSINGDI,BELABO,NARAYANPUR,90.85872,24.09833,20231,1
N V S MADHYAMIK BIDHYALAYA,112538,School,NARSINGDI,BELABO,JOAR GOBINDAPUR,90.84256,24.10156,20232,1
A.N.M HIGH SCHOOL,112552,School,NARSINGDI,BELABO,JOAR LAKSHMIPUR,90.81797,24.16408,20233,1
NAraYANPUR  S.U  HIGH SCHOOL,112542,School,NARSINGDI,BELABO,NARAYANPUR,90.81358,24.16044,20234,1
LAXMIPUR  HIGH SCHOOL,112543,School,NARSINGDI,BELABO,JOAR LAKSHMIPUR,90.81778,24.16353,20235,1
CHANDIPARA GIRLS HIGH SCHOOL,112539,School,NARSINGDI,BELABO,CHANDIPURA,90.87008,24.04589,20236,1
PATULI HIGH SCHOOL,112553,School,NARSINGDI,BELABO,PATULI,90.88017,24.08275,20238,1
PORADIA ADARSA HIGH SCHOOL,112541,School,NARSINGDI,BELABO,PORADIA,90.88533,24.07217,20239,1
SARRABAD DHANU MASTER HIGH SCHOOL,112556,School,NARSINGDI,BELABO,SARRABAD,90.92261,24.06083,20240,1
SUTARIA HIGH SCHOOL,112551,School,NARSINGDI,BELABO,NAGAR NALUAKOT,90.80817,24.15592,20241,1
SAYAN JUNIOR high SCHOOL,133870,School,NARSINGDI,BELABO,CHHAYAN,90.77547,24.15733,20242,1
KASIM NAGAR HIGH SCHOOL,112550,School,NARSINGDI,BELABO,CHAR KASHIMNAGAR,90.80519,24.15472,20243,1
PARATALA  SIKDER  A  MANNAN  HIGH SCHOOL,112831,School,NARSINGDI,SHIBPUR,ALINAGAR,90.86297,24.04842,20245,2
LAKHPUR SIMULIA HIGH SCHOOL,112825,School,NARSINGDI,SHIBPUR,ALINAGAR,90.83736,24.14706,20246,2
LAKHPUR SIMULIA GIRLS HIGH SCHOOL,112835,School,NARSINGDI,SHIBPUR,DULALPUR,90.86297,24.04842,20247,2
GARBARI M.A.  RASHID HIGH SCHOOL,112820,School,NARSINGDI,SHIBPUR,KHURDA MAHESHWARDI,90.64285,24.06199,20248,1
DULALPUR HIGH SCHOOL,112836,School,NARSINGDI,SHIBPUR,DULALPUR,90.6523,24.05119,20249,1
DULALPUR ROKEYA SMIRITI GIRLS HIGH SCHOOL,112849,School,NARSINGDI,SHIBPUR,DULALPUR,90.66869,24.07358,20250,1
DATTER GAON HIGH SCHOOL,112838,School,NARSINGDI,SHIBPUR,DATTAGAON,90.6938,24.07047,20251,1
BAZNABO ABUL FAIZ MOLLA HIGH SCHOOL,112859,School,NARSINGDI,SHIBPUR,KHARIA,90.68599,24.04744,20252,1
HARI HARDI HIGH SCHOOL,112833,School,NARSINGDI,SHIBPUR,GOBINDI,90.71253,24.04528,20253,1
DAKSHIN SADHARCHARCHR HIGH SCHOOL,112839,School,NARSINGDI,SHIBPUR,DAKSHIN SADHAR CHAR,90.70288,24.0427,20254,1
SAIDER KHOLA GIRLS HIGH SCHOOL,112828,School,NARSINGDI,SHIBPUR,SAIDERKHOLA,90.73305,24.03812,20255,1
TELIA JHAOWA KANDI GIRLS HIGH SCHOOL,112843,School,NARSINGDI,SHIBPUR,JAWAKANDI,90.73865,24.01742,20256,1
SYED NAGAR ATUAR RAHMAN HIGH SCHOOL,112830,School,NARSINGDI,SHIBPUR,KAMARGAON,90.70775,24.0067,20257,1
PUTIA HIGH SCHOOL,112827,School,NARSINGDI,SHIBPUR,KAMARGAON,90.68517,23.99438,20258,1
KARARCHAR MVI. TOFAZZAL HOSSAIN HIGH SCHOOL,112824,School,NARSINGDI,SHIBPUR,GUPTA PARA,90.6976,23.98427,20259,1
HAZI SHAMSHER ALI HIGH SCHOOL,112853,School,NARSINGDI,SHIBPUR,BHARATERKANDI,90.72217,24.00304,20260,1
KAZI MOFIZ UDDIN  HIGH SCHOOL,112840,School,NARSINGDI,SHIBPUR,SASPUR,90.73226,23.99342,20261,1
NOADIA KH.BOYS HIGH SCHOOL,112829,School,NARSINGDI,SHIBPUR,DAKSHIN NOADIA,90.72614,23.9717,20262,1
