inst name, eiin, inst_type, district, thana, mauza, long, lat, serial,isUnique
SHERPUR GOVT. COLLEGE, SHERPUR,113915,College,SHARIATPUR,SHARIATPUR SADAR,PALONG (PART),90.004,25.00508,2063,1
JAJIRA COLLEGE,113676,College,SHARIATPUR,ZANJIRA,DAKSHIN BAIKSHA,90.37085,23.35776,2064,1
DR. MOSLEM UDDIN KHAN DEGREE COLLEGE,113677,College,SHARIATPUR,ZANJIRA,JOYNAGAR,90.2943,23.29585,2065,1
B.K NAGAR BANGABANDHU COLLEGE,113675,College,SHARIATPUR,ZANJIRA,BARA KRISHNA NAGAR,90.26076,23.29719,2066,1
SHARIATPUR GOVT. COLLEGE,113647,College,SHARIATPUR,SHARIATPUR SADAR,CHANDSAR,90.32025,23.27197,2067,1
GOVT. GOLAM HAIDER KHAN MAHILA COLLEGE,113646,College,SHARIATPUR,SHARIATPUR SADAR,DHANUKA,90.36375,23.18372,2068,1
PANDITSAR T.M. GIAS UDDIN COLEGE,113607,College,SHARIATPUR,NARIA,DAKSHINPARA,90.47373,23.38433,2069,1
NARIA GOVT. COLLEGE,113608,College,SHARIATPUR,NARIA,DAKSHIN NARIA,90.33543,23.29223,2070,1
BHOJESWAR UPASHI COLLEGE,113609,College,SHARIATPUR,NARIA,UPASI,90.41626,23.30595,2071,1
SHAMSUR RAHMAN DEGREE COLLEGE,113575,College,SHARIATPUR,GOSAIRHAT,DASER JANGAL,90.49321,23.10161,2072,1
PURBA MADARI PUR COLLEGE,113552,College,SHARIATPUR,DAMUDYA,DAKSHIN DAMUDYA (PART-2),90.45805,23.17535,2073,1
HAZI SHARIATULLAH COLLEGE,113529,College,SHARIATPUR,BHEDARGANJ,CHAR SAKHIPUR,90.5006,23.37812,2074,1
SHAHID SIRAJ SIKDER DEGREE COLLEGE,113528,College,SHARIATPUR,BHEDARGANJ,DIGAR MAHISHKHALI,90.55624,23.20101,2075,1
M. A REZA DEGREE COLLEGE,113530,College,SHARIATPUR,BHEDARGANJ,MAHISAR,90.3927,23.20475,2076,1
HABIB ULLAH COLLEGE,113531,College,SHARIATPUR,BHEDARGANJ,CHAR SAKHIPUR,90.49907,23.23087,2077,1
DURBADANGA ABU BAKAR SI. DAKHIL MADRASAH,113672,Madrasha,SHARIATPUR,ZANJIRA,DUBLADANGA,89.82506,25.19511,9474,1
BOALIA GIRL'S DAKHIL MADRASAH,113667,Madrasha,SHARIATPUR,ZANJIRA,BOALIA,90.41971,23.33187,9475,1
CHARKHAMAR TAMIZIA DHAKHIL MADRASHA,113669,Madrasha,SHARIATPUR,ZANJIRA,CHAR KHAMAR,90.4168,23.32898,9476,1
JOYNAGAR NURIA ISLAMIA DAKHIL MADRASHA,113674,Madrasha,SHARIATPUR,ZANJIRA,JOYNAGAR,90.32685,23.33513,9477,1
NAWDOBA MOHSENIA DAKHIL MADRASHA,113666,Madrasha,SHARIATPUR,ZANJIRA,NAODOBA,90.25181,23.29055,9478,1
HAZI TAHER DHALI KANDI DAKHIL MADRASAH,113668,Madrasha,SHARIATPUR,ZANJIRA,NAODOBA,90.28162,23.3488,9479,1
KAZIAR CHAR HAMIDIA SUKURIA ALIM  MADRASHA,113671,Madrasha,SHARIATPUR,ZANJIRA,MIAHCHAND MUNSHIRKANDI,90.28616,23.39745,9480,1
JAJIRA SHAMSUL ULUM FAZIL MADRASA,113670,Madrasha,SHARIATPUR,ZANJIRA,KHOSAL SIKDARERKANDI(PART),90.26227,23.40545,9481,1
GONGA NAGAR AH. IS. DAKHIL DAMDRSHA,113673,Madrasha,SHARIATPUR,ZANJIRA,HAMGAON,90.31457,23.3858,9482,1
SENERCHAR KARIMUDDIN MADBAR KANDI DAKHIL MADRASAH,113665,Madrasha,SHARIATPUR,ZANJIRA,SENER CHAR,90.32588,23.33971,9483,1
CHIKANDI ISLAMIA SENIOR ALIM MADRASHA,113637,Madrasha,SHARIATPUR,SHARIATPUR SADAR,SAULA,90.27926,23.39479,9484,1
SHARIATPUR ISLAMIA  FAZIL MADRASAh,113639,Madrasha,SHARIATPUR,SHARIATPUR SADAR,TULASAR,90.32149,23.33482,9485,1
SHARIATPUR KAGDI DAKHIL MADRASAH,113636,Madrasha,SHARIATPUR,SHARIATPUR SADAR,KAGDI,90.36353,23.23935,9486,1
DADPUR BHASANCHAR ALIM MADRASA,113635,Madrasha,SHARIATPUR,SHARIATPUR SADAR,BHASAN CHAR,90.34815,23.22107,9487,1
KASHIPUR NESARIA DAKHIL MADRASAH,113642,Madrasha,SHARIATPUR,SHARIATPUR SADAR,KASHIPUR,90.37462,23.18969,9488,1
BENOD PUR SHARRIATIA DAKHIL MADRASAH,113634,Madrasha,SHARIATPUR,SHARIATPUR SADAR,BARA BINODPUR,90.33593,23.21358,9489,1
CHANDRAPUR MAZIDIA ISLAMIA ALIM MADRASAH,113640,Madrasha,SHARIATPUR,SHARIATPUR SADAR,CHANDRAPUR,90.30262,23.21597,9490,1
BAGDI GIRLS DAKHIL MADRASAH,113643,Madrasha,SHARIATPUR,SHARIATPUR SADAR,BAGADI,90.27691,23.2403,9491,1
SHARIATPUR ISLAMPUR GIRLS DAKHIL MADRASAH,113644,Madrasha,SHARIATPUR,SHARIATPUR SADAR,SWARNA GHOSH,90.28618,23.27015,9492,1
BENODPUR MOULAVI KANDI DAKHIL MADRASAH,113638,Madrasha,SHARIATPUR,SHARIATPUR SADAR,BARA BINODPUR,90.32629,23.2312,9493,1
MAHMUDPUR KHA PARA DAKHIL MADRASAH,113641,Madrasha,SHARIATPUR,SHARIATPUR SADAR,MOHAMMADPUR,90.36681,23.22478,9494,1
UTTAR NASASAN R. I ALIM MADRASAH.,113600,Madrasha,SHARIATPUR,NARIA,DAULA,90.39175,23.25746,9495,1
MULFAT GONJ AZIZIA JALALIA FAZIL MADRASHA,113601,Madrasha,SHARIATPUR,NARIA,KEDARPUR,90.46243,23.27407,9496,1
RAJNAGAR JAME-UL-ULUM DAKHIL MADRASHA,113603,Madrasha,SHARIATPUR,NARIA,RAJNAGAR,90.4661,23.2786,9497,1
AHMAD NAGAR DAKHIL MADRASHA,113605,Madrasha,SHARIATPUR,NARIA,KATHUGLI,90.41456,23.30642,9498,1
UTTAR JAPSA DAKHIL MADRASAh,113604,Madrasha,SHARIATPUR,NARIA,JAPSA,90.47273,23.26074,9499,1
BANGLA BAZAR ISLAMIA MADRASHA,113606,Madrasha,SHARIATPUR,NARIA,PASCHIM LONOGSHNGHA,90.43897,23.31715,9500,1
MOKTERER CHAR PORBA  PORAGACHA ISLAMIA DAKHIL MADRASHA,113602,Madrasha,SHARIATPUR,NARIA,PORAGACHHA,90.39931,23.25915,9501,1
GARIBER CHAR MOHIUS SUNNAH DAKHIL MADRASHA,113567,Madrasha,SHARIATPUR,GOSAIRHAT,UTTAR KODALPUR (PART),90.46144,23.31884,9502,1
KHALILUR RAHMAN ISLAMIA FAZIL  MADRASHA,113565,Madrasha,SHARIATPUR,GOSAIRHAT,GHATA KHAN,90.38434,23.31332,9503,1
IKRAKANDI DAKHIL MADRASHA,113571,Madrasha,SHARIATPUR,GOSAIRHAT,IKRAKANDI,90.51124,23.15108,9504,1
IDILPUR DAKHIL MADRASA,113572,Madrasha,SHARIATPUR,GOSAIRHAT,DASER JANGAL,90.43992,23.05231,9505,1
SHEKH FAZILATUN NESA ISLAMIA DAKHIL MADRASHA,113574,Madrasha,SHARIATPUR,GOSAIRHAT,CHAR SATMATIA,90.43027,23.05589,9506,1
LAxMIPUR DHALIR HAT FAZIL MADRASHA,113569,Madrasha,SHARIATPUR,GOSAIRHAT,LAKSHMIPUR,90.43405,23.07677,9507,1
CHAR SAMONTASAR MOHSENIa fazil MADRAShA,113570,Madrasha,SHARIATPUR,GOSAIRHAT,SAMANTASAR,90.4083,23.07012,9508,1
NAGERPARA AHAMADIA DAKHIL MADRASHA,113566,Madrasha,SHARIATPUR,GOSAIRHAT,NAGER PARA,90.39228,23.07822,9509,1
KASHI KHANDA ISLAMIA DAKHIL MADRASHA,113573,Madrasha,SHARIATPUR,GOSAIRHAT,KASHIKHANDA,90.35073,23.0877,9510,1
DAMUDYA  HAMIDIA KAMIL MADRASA,113546,Madrasha,SHARIATPUR,DAMUDYA,DAKSHIN DAMUDYA (PART-4),90.4225,23.11,9511,1
SHIDHAL KURA SHARIATIA DAKHIL MADRASHA,113545,Madrasha,SHARIATPUR,DAMUDYA,CHAR SIDULKURA,90.44179,23.15643,9512,1
BAHER CHAR HOSSAINIA DAKHIL MADRASHA,113548,Madrasha,SHARIATPUR,DAMUDYA,BAHIR CHAR,90.44509,23.151,9513,1
MALGAON ISLAMIA DAKHIL MADRASHA,113547,Madrasha,SHARIATPUR,DAMUDYA,CHAR MALGAON,90.44194,23.14894,9514,1
DAMODYA MOHILA DAKHIL MADRASHA,113550,Madrasha,SHARIATPUR,DAMUDYA,RAM ROYERKANDI,90.3828,23.15171,9515,1
PURBA DAMODYA HAWLADER BAZAR DARUSSAUNNAH DAKHIL MADRASHA,113549,Madrasha,SHARIATPUR,DAMUDYA,BAHEDYA,90.40815,23.16338,9516,1
CHAR SIDHAL KURA MOHILA DAKHIL MADRASHA,113551,Madrasha,SHARIATPUR,DAMUDYA,CHAR CHATIANI,90.47278,23.15713,9517,1
SAKIPUR  SULAMANIA  ISLAMIA DAKHIL MADRASA,113525,Madrasha,SHARIATPUR,BHEDARGANJ,CHAR SAKHIPUR,90.40617,23.12334,9518,1
BAHERCHAR  MOHAMMADIA  ISLAMIA  DAKHIL MADRASA,113527,Madrasha,SHARIATPUR,BHEDARGANJ,BAHER CHAR KADAMTALI,90.52782,23.24703,9519,1
MANUA  AHLE  SUNNAH  DAKHIL MADRASA,113523,Madrasha,SHARIATPUR,BHEDARGANJ,MANUA,90.51052,23.21021,9520,1
ALHAZ  KAZI DIDAR BOX  ISLAAMIA  DAKHIL  MADRASAH,113520,Madrasha,SHARIATPUR,BHEDARGANJ,BARA CHHAYGAON,90.44397,23.19382,9521,1
GAIYDDA  M.S FAZIL MADRASA,113521,Madrasha,SHARIATPUR,BHEDARGANJ,GAIDYA (PART),90.42474,23.19505,9522,1
RAMBHADRAPUR K I ALIM MADRASAH,113524,Madrasha,SHARIATPUR,BHEDARGANJ,RAMBHADRAPUR,90.443,23.20486,9523,1
CHARKUMARIA  ISLAMIA  ALIM MADRASA,113522,Madrasha,SHARIATPUR,BHEDARGANJ,CHAR CHANDA,90.43439,23.2152,9524,1
CHAR  BHAGA  SHANIKANDI  KHAJE MOHAMMAD  DAKHIL  MADRASA,113526,Madrasha,SHARIATPUR,BHEDARGANJ,CHAR BHAGA,90.46327,23.22546,9525,1
BARA KALINAGAR FAZIL MADRASHA,113568,Madrasha,SHARIATPUR,GOSAIRHAT,BARA KALINAGAR,90.75225,23.94919,9526,1
KAZIAR CHAR CHAMIR UDDIN HIGH SCHOOL,113653,School,SHARIATPUR,ZANJIRA,KAZIAR CHAR,89.82486,25.21314,23896,2
KUNDERCHR ABDUL MANNAN MALLIKER KANDI HIGH SCHOOL,113660,School,SHARIATPUR,ZANJIRA,RATINATH CHAR,89.82486,25.21314,23897,2
KUNDERCHAR KALU BEPARI HIGH SCHHOOL,113649,School,SHARIATPUR,ZANJIRA,KAKRABHOG,89.83017,25.14178,23898,1
AL HAJ MD ISMAIL MEMORIAL  HIGH SCHOOL,113659,School,SHARIATPUR,ZANJIRA,KALMIR CHAR,89.83675,25.15039,23899,1
JAJIRA MOHAR ALI PILOT HIGH SCHOOL,113648,School,SHARIATPUR,ZANJIRA,HARIASA,90.36475,23.35623,23900,1
Laukhola a S High School,113651,School,SHARIATPUR,ZANJIRA,JOYSAGAR,90.42725,23.35944,23901,1
JOYANAGAR ZULMAT ALI HIGH SCHOOL,113654,School,SHARIATPUR,ZANJIRA,JOYNAGAR,90.32905,23.32442,23902,1
MAHMUDA KHATUN HIGH SCHOOL,113658,School,SHARIATPUR,ZANJIRA,JOYNAGAR,90.29844,23.33245,23903,1
MANIK NAGAR SHIEKH HASINA  HIGH SCHOOL,113662,School,SHARIATPUR,ZANJIRA,MANIKNAGAR,90.2801,23.30676,23904,1
BARA KRISHNA NAGAR PUBLIC HIGH SCHOOL,113650,School,SHARIATPUR,ZANJIRA,BARA KRISHNA NAGAR,90.26253,23.29161,23905,1
PURBA NAWDOBA PUBLIC HIGH SCHOOL,113657,School,SHARIATPUR,ZANJIRA,PURBA NAODOBA,90.2536,23.29129,23906,1
AMJADIA ACADEMY,113652,School,SHARIATPUR,ZANJIRA,NAODOBA,90.26046,23.35923,23907,1
ABDUL GHANI HIGH SCHOOL,113655,School,SHARIATPUR,ZANJIRA,KATHURIA,90.25883,23.36006,23908,1
BARAKANDI MODEL ACADEMY,113663,School,SHARIATPUR,ZANJIRA,BARAKANDI,90.26392,23.41312,23909,1
BILASHPUR QUDDUS BEPARY  HIGH SCHOOL,113664,School,SHARIATPUR,ZANJIRA,MULAI BEPARIRKANDI,90.4203,23.34391,23910,1
SHOULPARA MONOR KHan HIGH SCHOOL,113624,School,SHARIATPUR,SHARIATPUR SADAR,SHAUL PARA,90.29444,23.3029,23911,1
PALONG HIGH SCHOOL,113616,School,SHARIATPUR,SHARIATPUR SADAR,PALONG (PART),90.27299,23.35486,23912,1
SHARIATPUR GOVT. GIRLS HIGH SCHOOL ,SARIATPUR,113614,School,SHARIATPUR,SHARIATPUR SADAR,TULASAR,90.30532,23.30817,23913,1
PALONG TULASHAR GURUDAS GOVT. HIGH SCHOOL,113615,School,SHARIATPUR,SHARIATPUR SADAR,TULASAR,90.32851,23.30007,23914,1
BURIRHAT HIGH SCHOOL,113612,School,SHARIATPUR,SHARIATPUR SADAR,CHANDANKAR,90.35739,23.23728,23915,1
SUBACHANI HIGH SCHOOL,113623,School,SHARIATPUR,SHARIATPUR SADAR,BARA SONAMUKHI,90.35941,23.22897,23916,1
TULATALA HIGH SCHOOL,113627,School,SHARIATPUR,SHARIATPUR SADAR,SINGARIA,90.36084,23.22689,23917,1
ANGARIA HIGH SCHOOL,113620,School,SHARIATPUR,SHARIATPUR SADAR,PASCHIM KASHABOG,90.37754,23.20872,23918,1
ANGARIA GIRLS HIGH SCHOOL,113613,School,SHARIATPUR,SHARIATPUR SADAR,PASCHIM KASHABOG,90.39662,23.20203,23919,1
CHITALIA SAMITIR HAT HIGH SCHOOL,113628,School,SHARIATPUR,SHARIATPUR SADAR,PASCHIMPAR,90.33842,23.16306,23920,1
BENODPUR PUBLIC HIGH SCHOOL,113622,School,SHARIATPUR,SHARIATPUR SADAR,BARA BINODPUR,90.31138,23.17862,23921,1
MAHMUD PUR MODERN HIGH SCHOOL,113629,School,SHARIATPUR,SHARIATPUR SADAR,MOHAMMADPUR,90.33349,23.21278,23922,1
CHANDRAPUR A.H.P.HIGH SCHOOL,113621,School,SHARIATPUR,SHARIATPUR SADAR,CHANDRAPUR,90.33316,23.21865,23923,1
RAIPUR ABDUL KHALEK TALUKDER HIGH SCHOOL,113625,School,SHARIATPUR,SHARIATPUR SADAR,ROYPUR,90.31649,23.24587,23924,1
RUDRAKAR NILMONI HIGH SCHOOL,113619,School,SHARIATPUR,SHARIATPUR SADAR,RUDRAKAR,90.27105,23.26299,23925,1
ABU TALEB MASTER  HIGH SCHOOL,113633,School,SHARIATPUR,SHARIATPUR SADAR,SUNDISAR,90.27075,23.26468,23926,1
CHIKANDI SARAF ALI HIGH SCHOOL,113617,School,SHARIATPUR,SHARIATPUR SADAR,SAULA,90.30443,23.27728,23927,1
BERA CHIKANDI HIGH SCHOOL,113630,School,SHARIATPUR,SHARIATPUR SADAR,BERA CHIKANDI,90.34785,23.25732,23928,1
  BHOJESHWAR HIGH SCHOOL,113587,School,SHARIATPUR,NARIA,MASURA,90.32167,23.27079,23929,1
BIJHARI UPASHI TARA PRASANNA HIGH SCHOOL,113585,School,SHARIATPUR,NARIA,UPASI,90.32162,23.25068,23930,1
CHAKDHA HIGH SCHOOL,113599,School,SHARIATPUR,NARIA,CHAKDHA,90.3505,23.2247,23931,1
SHAHEED SMRITI HIGH SCHOOL,113598,School,SHARIATPUR,NARIA,CHAMTA,90.27958,23.25155,23932,1
NAWPARA PUBLIC HIGH SCHOOL,113583,School,SHARIATPUR,NARIA,NAOPARA CHAR,90.3987,23.25714,23933,1
PANCHA PALLI G.R. HIGH SCHOOL,113579,School,SHARIATPUR,NARIA,MAGAR,90.42456,23.28824,23934,1
DR. K.A. LALIL HIGH SCHOOL,113581,School,SHARIATPUR,NARIA,DHAMARAN,90.43792,23.24863,23935,1
CHAR ATRA AZIZA HIGH SCHOOL,113592,School,SHARIATPUR,NARIA,CHAR ATRA,90.34479,23.28436,23936,1
TELIPARA HIGH SCHOOL,113591,School,SHARIATPUR,NARIA,SONDA,90.3457,23.28059,23937,1
PANDITHSIR HIGH SCHOOL,113589,School,SHARIATPUR,NARIA,PANDITSAR,90.42554,23.23303,23938,1
SHAHEED NAZRUL GIRLS HIGH SCHOOL,113594,School,SHARIATPUR,NARIA,BAHIR KUSIA,90.42327,23.26917,23939,1
SHAHEED ABDUS SAMAD HIGH SCHOOL,113580,School,SHARIATPUR,NARIA,MAIJ PARA,90.45378,23.34388,23940,1
HALAISAR NANDANSAR HIGH SCHOOL,113582,School,SHARIATPUR,NARIA,NANDANSAR,90.44271,23.26337,23941,1
KEDARPUR HIGH SCHOOL,113595,School,SHARIATPUR,NARIA,KEDARPUR,90.45853,23.28196,23942,1
MOHISH KHOLA HIGH SCHOOL,113597,School,SHARIATPUR,NARIA,MAHISHKHOLA,90.37403,23.25685,23943,1
LONSING HIGH SCHOOL,113590,School,SHARIATPUR,NARIA,PURBA LONSINGHA,90.46746,23.30261,23944,1
NARIA BIHARI LAL Pilot HIGH SCHOOL,113584,School,SHARIATPUR,NARIA,DAKSHIN NARIA,90.43314,23.30505,23945,1
NARIA PILOT GIRLS HIGH SCHOOL,113586,School,SHARIATPUR,NARIA,NIKARI PARA,90.43846,23.31021,23946,1
KARTIKPUR HIGH SCHOOL,113588,School,SHARIATPUR,NARIA,DINGA MANIK,90.3783,23.30702,23947,1
CHANDI PUR HIGH SCHOOL,113577,School,SHARIATPUR,NARIA,PANCHGAON,90.41863,23.2955,23948,1
GARIBERCHAR  secondary SCHOOL,113554,School,SHARIATPUR,GOSAIRHAT,UTTAR KODALPUR (PART),90.45767,23.25274,23949,1
KODALPUR  secondary  SCHOOL,113555,School,SHARIATPUR,GOSAIRHAT,DAYEMI KODALPUR,90.37795,23.29001,23950,1
HATURIA  SECONDARY   SCHOOL,113558,School,SHARIATPUR,GOSAIRHAT,PANCHKATI,90.41195,23.29192,23951,1
IDILPUR  SECONDARY  GIRLS   SCHOOL,113557,School,SHARIATPUR,GOSAIRHAT,DASER JANGAL,90.51134,23.14528,23952,1
IDILPUR PILOT HIGH SCHOOL,113556,School,SHARIATPUR,GOSAIRHAT,DHIPUR,90.44413,23.05356,23953,1
DEWAN  MOFIz UDDIN  HIGH  SCHOOL,113562,School,SHARIATPUR,GOSAIRHAT,MACHUAKHALI,90.43555,23.07387,23954,1
BARA  KALINAGAR  SECONDARY  SCHOOL,113561,School,SHARIATPUR,GOSAIRHAT,BARA KALINAGAR,90.43357,23.08432,23955,1
NAGERPARA  HIGH  SCHOOL.,113560,School,SHARIATPUR,GOSAIRHAT,NAGER PARA,90.43031,23.0834,23956,1
SAMANTASAR  secondary  SCHOOL,113559,School,SHARIATPUR,GOSAIRHAT,CHAR SAMANTASAR,90.37126,23.07688,23957,1
SIDDYA HIGH SCHOOL,113541,School,SHARIATPUR,DAMUDYA,SIDYA,90.39113,23.0956,23958,1
DARUL AMAN HIGH SCHOOL,113537,School,SHARIATPUR,DAMUDYA,PASCHIM NANDRA,90.42154,23.11192,23959,1
PURBA DAMODYA ADARSHA HIGH SCHOOL,113532,School,SHARIATPUR,DAMUDYA,CHAR NARAYANPUR,90.39092,23.0946,23960,1
DAMODYA MUSLIM HIGH SCHOOL,113534,School,SHARIATPUR,DAMUDYA,DAKSHIN DAMUDYA (PART-3),90.46735,23.0932,23961,1
DAMUDYA PILOT GIRLS HIGH SCHOOL F,113533,School,SHARIATPUR,DAMUDYA,DAKSHIN DAMUDYA (PART-2),90.44136,23.18725,23962,1
AL HAJ IMAM UDDIN HIGH SHCOOL,113535,School,SHARIATPUR,DAMUDYA,DAKSHIN DAMUDYA (PART-1),90.47383,23.16385,23963,1
SHIDHAL KURA HIGH SCHOOL,113538,School,SHARIATPUR,DAMUDYA,BARA SIDULKURA,90.4451,23.15435,23964,1
CHARMAL GAON HIGH SCHOOL,113539,School,SHARIATPUR,DAMUDYA,CHAR MALGAON,90.44363,23.14938,23965,1
KANESWAR S.C. EDWARD INSTITUTION,113536,School,SHARIATPUR,DAMUDYA,KANAKESHWAR,90.41341,23.12432,23966,1
ADARSHA BALIKA HIGH SCHOOL,113540,School,SHARIATPUR,DAMUDYA,ALTAKURI,90.41878,23.13001,23967,1
IDRIS ALI HIGH SCHOOL,113542,School,SHARIATPUR,DAMUDYA,BAHEDYA,90.37861,23.1251,23968,1
DARUS SALAM  HIGH SCHOOL,113543,School,SHARIATPUR,DAMUDYA,DAYEMI CHAR BHAYRA,90.37894,23.151,23969,1
MIR ABDUL MAZID HIGH SCHOOL,113544,School,SHARIATPUR,DAMUDYA,CHAR PATALIA,90.41564,23.15937,23970,1
ABC JUNIOR HIGH SCHOOL,113512,School,SHARIATPUR,BHEDARGANJ,KRISHNAPUR,90.46529,23.15715,23971,1
SHAHEED BUDDHIJIBI DR. HUMAYUN KABIR SCHOOL,113517,School,SHARIATPUR,BHEDARGANJ,CHAR BHAGA,90.45639,23.15826,23972,1
RARI KANDI HAZI BARI GIRLS HIGH SCHOOL,113499,School,SHARIATPUR,BHEDARGANJ,CHAR SAKHIPUR,90.37712,23.11736,23973,1
SAKHIPUR ISLAMIA HIGH SCHOOL,113498,School,SHARIATPUR,BHEDARGANJ,CHAR SAKHIPUR,90.44874,23.11412,23974,1
DAKHIN SAKHIPUR MADHAYAMIK BIDAYALAYA,113496,School,SHARIATPUR,BHEDARGANJ,CHAR SAKHIPUR,90.52441,23.28969,23975,1
TARABUNIA  HIGH SCHOOL,113500,School,SHARIATPUR,BHEDARGANJ,CHAR CENSUS,90.51313,23.24433,23976,1
CHAR FILIJ JAINAB HIGH SCHOOL,113510,School,SHARIATPUR,BHEDARGANJ,CHAR PHYLIS,90.52357,23.24258,23977,1
CHAR KUMARIA HIGH SCHOOL,113508,School,SHARIATPUR,BHEDARGANJ,DAKSHIN CHAR KUMARIA,90.53341,23.2484,23978,1
CHAR BHOIRA HIGH SCHOOL,113495,School,SHARIATPUR,BHEDARGANJ,DIGAR MAHISHKHALI,90.56791,23.25701,23979,1
NARAYAN PUR UNION HIGH SCHOOL,113514,School,SHARIATPUR,BHEDARGANJ,PUTIA (PART),90.53358,23.17112,23980,1
SAJANPUR  GIRLS  HIGH SCHOOL,113507,School,SHARIATPUR,BHEDARGANJ,PUTIJURI,90.50412,23.17695,23981,1
SAJANPUR ISLAMIA HIGH SCHOOL,113503,School,SHARIATPUR,BHEDARGANJ,SAJANPUR,90.50022,23.18039,23982,1
AZIZUR RAHMAN HIGH SCHOOL,113506,School,SHARIATPUR,BHEDARGANJ,BARA CHHAYGAON,90.50763,23.20738,23983,1
BHENOPA NASIRUDDIN HIGH SCHOOL,113513,School,SHARIATPUR,BHEDARGANJ,NAZIMPUR,90.42934,23.19028,23984,1
VEDORGANJ HEAD QUATER PILOT HIGH SCHOOL,113504,School,SHARIATPUR,BHEDARGANJ,MAHISAR,90.40944,23.18123,23985,1
MAHISHAR DIGAMBARI HIGH SCHOOL,113497,School,SHARIATPUR,BHEDARGANJ,MAHISAR,90.39772,23.20838,23986,1
RAMVADRA PUR REBOTI MOHAN HIGH  SCHOOL,113501,School,SHARIATPUR,BHEDARGANJ,RAMBHADRAPUR,90.40994,23.22052,23987,1
MONOWARA SIKDER GIRlS high SCHOOL,113516,School,SHARIATPUR,BHEDARGANJ,DIGAR MAHISHKHALI,90.4445,23.20762,23988,1
CHARCHANDA  HIGH SCHOOL,113505,School,SHARIATPUR,BHEDARGANJ,DIGAR MAHISHKHALI,90.45162,23.20617,23989,1
CHARBANGA  BANGABANDHU  IDEAL HIGH SCHOOL,113515,School,SHARIATPUR,BHEDARGANJ,CHAR BHAGA,90.46025,23.22348,23990,1
CHAR BHAGA HIGH SCHOOL,113502,School,SHARIATPUR,BHEDARGANJ,CHAR BHAGA,90.50537,23.22081,23991,1
DULARCHAR HIGH SCHOOL,113509,School,SHARIATPUR,BHEDARGANJ,DULAR CHAR,90.49868,23.22523,23992,1
ABBAS ALI HIGH SCHOOL,113511,School,SHARIATPUR,BHEDARGANJ,CHAR TARABUNIA,90.50691,23.27197,23993,1
KIRON NAGOR ADARSHO HIGH SCHOOL,113494,School,SHARIATPUR,BHEDARGANJ,CHAR TARABUNIA (PART),90.5083,23.27788,23994,1
ABDUL GONI HIGH SCHOOL,113518,School,SHARIATPUR,BHEDARGANJ,CHAR SAKHIPUR,90.51261,23.28757,23995,1
ABDUR RAZZAK SECondary  GIRLS SCHOOL,113564,School,SHARIATPUR,GOSAIRHAT,DAYEMI KODALPUR,90.81449,23.98363,23996,1
DHAKSHIN DUBALDIA ABDUR RAZZAK HIGH SCHOOL AND COLLEGE,113661,School and College,SHARIATPUR,ZANJIRA,DAKSHIN DUBULDIA,90.25223,23.39963,26366,1
ZAZIRA GIRLS HIGH SCHOOL& COLLEGE,113678,School and College,SHARIATPUR,ZANJIRA,HARIASA,90.36093,23.37051,26367,1
GONGANAGAR ADARSHA  SCHOOL AND COLLEGE,113611,School and College,SHARIATPUR,SHARIATPUR SADAR,GAYGHAR,90.35407,23.37306,26368,1
DOMSHAR JAGAT CHANDRA INSTITUTION AND COLLEGE,113618,School and College,SHARIATPUR,SHARIATPUR SADAR,KOARPUR,90.26124,23.23456,26369,1
DOGREE ISMAIL HOSSAIN SCHOOL AND COLLEGE,113578,School and College,SHARIATPUR,NARIA,DAGRI,90.27083,23.23868,26370,1
SURESWAR HIGH SCHOOL & COLLEGE, SURESWAR, NARIA,113593,School and College,SHARIATPUR,NARIA,SURESHWAR,90.41456,23.30513,26371,1
